Annotated Answer,Final_Output,Original_Query,Quality_of_Answer,Query Type,Total_Cost,Total_Energy,Total_Latency,assignment,category,cost,energy,iteration,latency,plan,qoa,query_type,run_time_seconds,source_file,step_logs,struct_id,New_QoA_Score
H,H,An allele that is masked is referred to as: A) reclusive. B) residual. C) resistant. D) reductive. E) reactive. F) reflective. G) redundant. H) recessive. I) refractive. J) repressed. Above are multiple-choice questions (with answers) related to health. Respond with the option letter only. Example: F. Do not include any other text or explanation.,1.0,health_mmlu,1.3112e-05,46.35679400000001,71.35241799999999,"(0, 0, 0)",results_health_mmlu,2.412e-05,83.8995608,1,129.13827759999998,"[([0, 1], ['mistral:7b', 'mistral:7b']), ([1, 2], ['mistral:7b', 'mistral:7b'])]",0.7650864779949188,health_mmlu,17245.342367887497,qoa_results_health_mmlu_pop200_gen200_add0p3_flip0p1_mut0p3_level4_bound5_cb2p44em05_lb200_20.csv,"[{""node"": 0, ""type"": ""leaf"", ""model"": ""mistral:7b"", ""prompt"": ""Question: An allele that is masked is referred to as: A) reclusive. B) residual. C) resistant. D) reductive. E) reactive. F) reflective. G) redundant. H) recessive. I) refractive. J) repressed. Above are multiple-choice questions (with answers) related to health. Respond with the option letter only. Example: F. Do not include any other text or explanation.\n\nSelect the correct answer.\n\nFormat: \""the answer is X)Option text.\""\nExample: \""the answer is C)Hypertension.\""\n\nOutput (nothing else):"", ""raw_output"": ""the answer is H) recessive."", ""output"": ""the answer is H) recessive."", ""input_tokens"": 124, ""output_tokens"": 8}, {""node"": 1, ""type"": ""verification"", ""model"": ""mistral:7b"", ""prompt"": ""Question: An allele that is masked is referred to as: A) reclusive. B) residual. C) resistant. D) reductive. E) reactive. F) reflective. G) redundant. H) recessive. I) refractive. J) repressed. Above are multiple-choice questions (with answers) related to health. Respond with the option letter only. Example: F. Do not include any other text or explanation.\n\nAnswer to verify: the answer is H) recessive.\n\nTask: Check accuracy and format.\n\nRules:\n- If correct and properly formatted, output it exactly\n- If wrong answer, provide correct answer\n- Use format: \""the answer is X)Option text.\""\n\nOutput (nothing else):"", ""parent_output"": ""the answer is H) recessive."", ""raw_output"": ""the answer is H) recessive."", ""output"": ""the answer is H) recessive."", ""input_tokens"": 149, ""output_tokens"": 8}, {""node"": 2, ""type"": ""verification"", ""model"": ""mistral:7b"", ""prompt"": ""Question: An allele that is masked is referred to as: A) reclusive. B) residual. C) resistant. D) reductive. E) reactive. F) reflective. G) redundant. H) recessive. I) refractive. J) repressed. Above are multiple-choice questions (with answers) related to health. Respond with the option letter only. Example: F. Do not include any other text or explanation.\n\nAnswer to verify: the answer is H) recessive.\n\nTask: Check accuracy and format.\n\nRules:\n- If correct and properly formatted, output it exactly\n- If wrong answer, provide correct answer\n- Use format: \""the answer is X)Option text.\""\n\nOutput (nothing else):"", ""parent_output"": ""the answer is H) recessive."", ""raw_output"": ""the answer is H) recessive."", ""output"": ""the answer is H) recessive."", ""input_tokens"": 149, ""output_tokens"": 8}]",5,1.0
F,F,"This question refers to the following information.
""The struggle against neo-colonialism is not aimed at excluding the capital of the developed world from operating in less developed countries. It is aimed at preventing the financial power of the developed countries being used in such a way as to impoverish the less developed.
Non-alignment, as practiced by Ghana and many other countries, is based on co-operation with all States whether they be capitalist, socialist or have a mixed economy. Such a policy, therefore, involves foreign investment from capitalist countries, but it must be invested in accordance with a national plan drawn up by the government of the non-aligned State with its own interests in mind. The issue is not what return the foreign investor receives on his investments…The question is one of power. A State in the grip of neo-colonialism is not master of its own destiny.""
Kwame Nkrumah, Neo-Colonialism, 1965
Which of the following is referenced by the co-operation mentioned in the second paragraph? A) The competing ideologies of World War II B) The competing colonization companies in the Scramble for Africa C) The competing empires of World War I D) The competing blocs during the Korean War E) The competing empires during the Crusades F) The competing ideologies of the Cold War G) The competing powers during the Industrial Revolution H) The competing nations during the Cuban Missile Crisis I) The competing political systems during the French Revolution J) The competing alliances during the Napoleonic Wars Above are multiple-choice questions (with answers) related to history. Respond with the option letter only. Example: F. Do not include any other text or explanation.",1.0,history_mmlu,2.58e-05,26.172758,37.478132,"(3,)",results_history_mmlu,1.9002e-05,16.39981,1,23.48374,"[([0], ['qwen2.5:14b'])]",0.8696298778057099,history_mmlu,6331.870313644409,qoa_results_history_mmlu_pop200_gen200_add0p3_flip0p1_mut0p3_level4_bound5_cb2p44em05_lb38.94_20.csv,"[{""node"": 0, ""type"": ""leaf"", ""model"": ""qwen2.5:14b"", ""prompt"": ""Question: This question refers to the following information.\n\""The struggle against neo-colonialism is not aimed at excluding the capital of the developed world from operating in less developed countries. It is aimed at preventing the financial power of the developed countries being used in such a way as to impoverish the less developed.\nNon-alignment, as practiced by Ghana and many other countries, is based on co-operation with all States whether they be capitalist, socialist or have a mixed economy. Such a policy, therefore, involves foreign investment from capitalist countries, but it must be invested in accordance with a national plan drawn up by the government of the non-aligned State with its own interests in mind. The issue is not what return the foreign investor receives on his investments\u2026The question is one of power. A State in the grip of neo-colonialism is not master of its own destiny.\""\nKwame Nkrumah, Neo-Colonialism, 1965\nWhich of the following is referenced by the co-operation mentioned in the second paragraph? A) The competing ideologies of World War II B) The competing colonization companies in the Scramble for Africa C) The competing empires of World War I D) The competing blocs during the Korean War E) The competing empires during the Crusades F) The competing ideologies of the Cold War G) The competing powers during the Industrial Revolution H) The competing nations during the Cuban Missile Crisis I) The competing political systems during the French Revolution J) The competing alliances during the Napoleonic Wars Above are multiple-choice questions (with answers) related to history. Respond with the option letter only. Example: F. Do not include any other text or explanation.\n\nSelect the correct answer.\n\nFormat: \""the answer is X)Option text.\""\nExample: \""the answer is C)Hypertension.\""\n\nOutput (nothing else):"", ""raw_output"": ""the answer is F)The competing ideologies of the Cold War."", ""output"": ""the answer is F)The competing ideologies of the Cold War."", ""input_tokens"": 378, ""output_tokens"": 13}]",0,1.0
H,H,Which of the following entities is a state? A) American Samoa B) Hong Kong C) Gibraltar D) Greenland E) Puerto Rico F) Bermuda G) Antarctica H) Egypt Above are multiple-choice questions (with answers) related to other. Respond with the option letter only. Example: F. Do not include any other text or explanation.,1.0,other_mmlu,1.057e-05,9.344496,6.71048,"(4,)",results_other_mmlu,1.6243e-05,14.1168636,1,10.137618,"[([0], ['gemma3:27b'])]",0.926742571592331,other_mmlu,6959.505929708481,qoa_results_other_mmlu_pop200_gen200_add0p3_flip0p1_mut0p3_level4_bound5_cb2p44em05_lb200_20.csv,"[{""node"": 0, ""type"": ""leaf"", ""model"": ""gemma3:27b"", ""prompt"": ""Question: Which of the following entities is a state? A) American Samoa B) Hong Kong C) Gibraltar D) Greenland E) Puerto Rico F) Bermuda G) Antarctica H) Egypt Above are multiple-choice questions (with answers) related to other. Respond with the option letter only. Example: F. Do not include any other text or explanation.\n\nSelect the correct answer.\n\nFormat: \""the answer is X)Option text.\""\nExample: \""the answer is C)Hypertension.\""\n\nOutput (nothing else):"", ""raw_output"": ""the answer is H)Egypt."", ""output"": ""the answer is H)Egypt."", ""input_tokens"": 105, ""output_tokens"": 7}]",0,1.0
A,A,"Christopher Heath Wellman defends the position that A) nation-states have a presumptive right to close their borders to all potential immigrants. B) nation-states have an obligation to close their borders to protect their own citizens. C) closing borders to all potential immigrations is an inherently racist social policy. D) anti-egalitarianism is incompatible with liberal cosmopolitanism. E) anti-egalitarianism is compatible with liberal cosmopolitanism. F) nation-states have an obligation to open their borders to the least well-off potential immigrants. G) all borders should be entirely open, with no restrictions on immigration. H) the concept of nation-states should be abolished in favor of a global government. I) potential immigrants have a presumptive right to cross any border they choose. J) nation-states should prioritize their own citizens' needs over potential immigrants. Above are multiple-choice questions (with answers) related to philosophy. Respond with the option letter only. Example: F. Do not include any other text or explanation.",1.0,philosophy_mmlu,3.5176e-05,88.255522,130.46974699999998,"(2, 0, 0)",results_philosophy_mmlu,2.29784e-05,55.3598823,1,81.8522254,"[([0, 1], ['phi4:14b', 'mistral:7b']), ([1, 2], ['mistral:7b', 'mistral:7b'])]",0.937721312046051,philosophy_mmlu,6380.573192358017,qoa_results_philosophy_mmlu_pop200_gen200_add0p3_flip0p1_mut0p3_level4_bound5_cb2p44em05_lb200_20.csv,"[{""node"": 0, ""type"": ""leaf"", ""model"": ""phi4:14b"", ""prompt"": ""Question: Christopher Heath Wellman defends the position that A) nation-states have a presumptive right to close their borders to all potential immigrants. B) nation-states have an obligation to close their borders to protect their own citizens. C) closing borders to all potential immigrations is an inherently racist social policy. D) anti-egalitarianism is incompatible with liberal cosmopolitanism. E) anti-egalitarianism is compatible with liberal cosmopolitanism. F) nation-states have an obligation to open their borders to the least well-off potential immigrants. G) all borders should be entirely open, with no restrictions on immigration. H) the concept of nation-states should be abolished in favor of a global government. I) potential immigrants have a presumptive right to cross any border they choose. J) nation-states should prioritize their own citizens' needs over potential immigrants. Above are multiple-choice questions (with answers) related to philosophy. Respond with the option letter only. Example: F. Do not include any other text or explanation.\n\nSelect the correct answer.\n\nFormat: \""the answer is X)Option text.\""\nExample: \""the answer is C)Hypertension.\""\n\nOutput (nothing else):"", ""raw_output"": ""The answer is A) nation-states have a presumptive right to close their borders to all potential immigrants."", ""output"": ""the answer is A) nation-states have a presumptive right to close their borders to all potential immigrants."", ""input_tokens"": 240, ""output_tokens"": 21}, {""node"": 1, ""type"": ""verification"", ""model"": ""mistral:7b"", ""prompt"": ""Question: Christopher Heath Wellman defends the position that A) nation-states have a presumptive right to close their borders to all potential immigrants. B) nation-states have an obligation to close their borders to protect their own citizens. C) closing borders to all potential immigrations is an inherently racist social policy. D) anti-egalitarianism is incompatible with liberal cosmopolitanism. E) anti-egalitarianism is compatible with liberal cosmopolitanism. F) nation-states have an obligation to open their borders to the least well-off potential immigrants. G) all borders should be entirely open, with no restrictions on immigration. H) the concept of nation-states should be abolished in favor of a global government. I) potential immigrants have a presumptive right to cross any border they choose. J) nation-states should prioritize their own citizens' needs over potential immigrants. Above are multiple-choice questions (with answers) related to philosophy. Respond with the option letter only. Example: F. Do not include any other text or explanation.\n\nAnswer to verify: the answer is A) nation-states have a presumptive right to close their borders to all potential immigrants.\n\nTask: Check accuracy and format.\n\nRules:\n- If correct and properly formatted, output it exactly\n- If wrong answer, provide correct answer\n- Use format: \""the answer is X)Option text.\""\n\nOutput (nothing else):"", ""parent_output"": ""the answer is A) nation-states have a presumptive right to close their borders to all potential immigrants."", ""raw_output"": ""The answer is A) nation-states have a presumptive right to close their borders to all potential immigrants."", ""output"": ""the answer is A) nation-states have a presumptive right to close their borders to all potential immigrants."", ""input_tokens"": 278, ""output_tokens"": 21}, {""node"": 2, ""type"": ""verification"", ""model"": ""mistral:7b"", ""prompt"": ""Question: Christopher Heath Wellman defends the position that A) nation-states have a presumptive right to close their borders to all potential immigrants. B) nation-states have an obligation to close their borders to protect their own citizens. C) closing borders to all potential immigrations is an inherently racist social policy. D) anti-egalitarianism is incompatible with liberal cosmopolitanism. E) anti-egalitarianism is compatible with liberal cosmopolitanism. F) nation-states have an obligation to open their borders to the least well-off potential immigrants. G) all borders should be entirely open, with no restrictions on immigration. H) the concept of nation-states should be abolished in favor of a global government. I) potential immigrants have a presumptive right to cross any border they choose. J) nation-states should prioritize their own citizens' needs over potential immigrants. Above are multiple-choice questions (with answers) related to philosophy. Respond with the option letter only. Example: F. Do not include any other text or explanation.\n\nAnswer to verify: the answer is A) nation-states have a presumptive right to close their borders to all potential immigrants.\n\nTask: Check accuracy and format.\n\nRules:\n- If correct and properly formatted, output it exactly\n- If wrong answer, provide correct answer\n- Use format: \""the answer is X)Option text.\""\n\nOutput (nothing else):"", ""parent_output"": ""the answer is A) nation-states have a presumptive right to close their borders to all potential immigrants."", ""raw_output"": ""the answer is A) nation-states have a presumptive right to close their borders to all potential immigrants."", ""output"": ""the answer is A) nation-states have a presumptive right to close their borders to all potential immigrants."", ""input_tokens"": 278, ""output_tokens"": 21}]",5,1.0
A,A,A Michelson interferometer is used for measuring the separation of a doublet of atomic emission lines. The average wavelength of the doublet is known to be 676 nm. Periodic variations of the fringe contrast are found whenever one of the mirrors is moved through a distance of 0.44 mm. What are the two wavelengths of the doublet? A) 675.74 nm and 676.26 nm B) 676.1 nm and 675.9 nm C) 672 nm and 680 nm D) 675 nm and 677 nm E) 674 nm and 678 nm F) 670 nm and 680 nm G) 674.5 nm and 677.5 nm H) 673 nm and 679 nm I) 676.5 nm and 675.5 nm J) 677 nm and 675 nm Above are multiple-choice questions (with answers) related to physics. Respond with the option letter only. Example: F. Do not include any other text or explanation.,1.0,physics_mmlu,2.326e-05,21.108549,15.158495,"(4,)",results_physics_mmlu,1.89375e-05,16.58230875,1,11.90810625,"[([0], ['gemma3:27b'])]",0.6390483528375626,physics_mmlu,4531.872090816498,qoa_results_physics_mmlu_pop200_gen200_add0p3_flip0p1_mut0p3_level4_bound5_cb2p44em05_lb38.94_20.csv,"[{""node"": 0, ""type"": ""leaf"", ""model"": ""gemma3:27b"", ""prompt"": ""Question: A Michelson interferometer is used for measuring the separation of a doublet of atomic emission lines. The average wavelength of the doublet is known to be 676 nm. Periodic variations of the fringe contrast are found whenever one of the mirrors is moved through a distance of 0.44 mm. What are the two wavelengths of the doublet? A) 675.74 nm and 676.26 nm B) 676.1 nm and 675.9 nm C) 672 nm and 680 nm D) 675 nm and 677 nm E) 674 nm and 678 nm F) 670 nm and 680 nm G) 674.5 nm and 677.5 nm H) 673 nm and 679 nm I) 676.5 nm and 675.5 nm J) 677 nm and 675 nm Above are multiple-choice questions (with answers) related to physics. Respond with the option letter only. Example: F. Do not include any other text or explanation.\n\nSelect the correct answer.\n\nFormat: \""the answer is X)Option text.\""\nExample: \""the answer is C)Hypertension.\""\n\nOutput (nothing else):"", ""raw_output"": ""the answer is A)675.74 nm and 676.26 nm."", ""output"": ""the answer is A)675."", ""input_tokens"": 246, ""output_tokens"": 7}]",0,1.0
E,E,"Alice, age 14, is certain that everyone is looking at her because she has a large blemish in the middle of her forehead. According to Elkind (1967), Alice's belief is a manifestation of: A) the “personal fable.” B) ""theory of mind."" C) the “egocentrism.” D) self-concept. E) the “imaginary audience.” F) moral development. G) the “looking-glass self.” H) social referencing. I) self-conscious emotions. J) social comparison. Above are multiple-choice questions (with answers) related to psychology. Respond with the option letter only. Example: F. Do not include any other text or explanation.",1.0,psychology_mmlu,1.814e-05,16.102569,11.563595,"(4,)",results_psychology_mmlu,1.5612999999999998e-05,13.766445,1,9.885975,"[([0], ['gemma3:27b'])]",0.942040741443634,psychology_mmlu,7501.701446533203,qoa_results_psychology_mmlu_pop200_gen200_add0p3_flip0p1_mut0p3_level4_bound5_cb2p44em05_lb38.94_20.csv,"[{""node"": 0, ""type"": ""leaf"", ""model"": ""gemma3:27b"", ""prompt"": ""Question: Alice, age 14, is certain that everyone is looking at her because she has a large blemish in the middle of her forehead. According to Elkind (1967), Alice's belief is a manifestation of: A) the \u201cpersonal fable.\u201d B) \""theory of mind.\"" C) the \u201cegocentrism.\u201d D) self-concept. E) the \u201cimaginary audience.\u201d F) moral development. G) the \u201clooking-glass self.\u201d H) social referencing. I) self-conscious emotions. J) social comparison. Above are multiple-choice questions (with answers) related to psychology. Respond with the option letter only. Example: F. Do not include any other text or explanation.\n\nSelect the correct answer.\n\nFormat: \""the answer is X)Option text.\""\nExample: \""the answer is C)Hypertension.\""\n\nOutput (nothing else):"", ""raw_output"": ""the answer is E)the \u201cimaginary audience.\u201d"", ""output"": ""the answer is E)the \u201cimaginary audience."", ""input_tokens"": 182, ""output_tokens"": 11}]",0,1.0
