Annotated Answer,Final_Output,Original_Query,Quality_of_Answer,Query Type,Total_Cost,Total_Energy,Total_Latency,assignment,category,cost,energy,iteration,latency,plan,qoa,query_type,run_time_seconds,source_file,step_logs,struct_id,New_QoA_Score
I,H,"For a two-level system where $v=1.50 \times 10^{13} \mathrm{~s}^{-1}$, determine the temperature at which the internal energy is equal to $0.25 \mathrm{Nhv}$, or $1 / 2$ the limiting value of $0.50 \mathrm{Nhv}$. A) 300 K B) 725 $\mathrm{~K}$ C) 1000 K D) 580 K E) 870 K F) 500 $\mathrm{~K}$ G) 400 K H) 800 $\mathrm{~K}$ I)  655 $\mathrm{~K}$ J) 950 K Above are multiple-choice questions (with answers) related to physics. Respond with the option letter only. Example: F. Do not include any other text or explanation.",0.0283347833901643,physics_mmlu,6.424e-06,23.074458,35.516226,"(0,)",results_physics_mmlu,9.654e-06,27.77769775,1,42.75545674999999,"[([0], ['mistral:7b'])]",0.6672193147242069,physics_mmlu,5619.190279006958,qoa_results_physics_mmlu_pop200_gen200_add0p3_flip0p1_mut0p3_level4_bound5_cb1p22em05_lb200_20.csv,"[{""node"": 0, ""type"": ""leaf"", ""model"": ""mistral:7b"", ""prompt"": ""Question: For a two-level system where $v=1.50 \\times 10^{13} \\mathrm{~s}^{-1}$, determine the temperature at which the internal energy is equal to $0.25 \\mathrm{Nhv}$, or $1 / 2$ the limiting value of $0.50 \\mathrm{Nhv}$. A) 300 K B) 725 $\\mathrm{~K}$ C) 1000 K D) 580 K E) 870 K F) 500 $\\mathrm{~K}$ G) 400 K H) 800 $\\mathrm{~K}$ I)  655 $\\mathrm{~K}$ J) 950 K Above are multiple-choice questions (with answers) related to physics. Respond with the option letter only. Example: F. Do not include any other text or explanation.\n\nSelect the correct answer.\n\nFormat: \""the answer is X)Option text.\""\nExample: \""the answer is C)Hypertension.\""\n\nOutput (nothing else):"", ""raw_output"": ""the answer is H) 800 K"", ""output"": ""the answer is H) 800 K"", ""input_tokens"": 214, ""output_tokens"": 8}]",0,0.0
41,Correct,"For how many years was the original Omsund Bridge in Kristiansund, Norway, in use?",0.2095616459846496,Geography,3.827e-06,10.657113,15.968861,"(1, 0)",results_geography,1.1672333333333332e-05,30.131003000000003,1,44.83388433333334,"[([0, 1], ['llama3-chatqa:8b', 'mistral:7b'])]",0.3783546984195709,Geography,14552.033256530762,qoa_results_geography_pop200_gen200_add0p3_flip0p1_mut0p3_level4_bound5_cb1p22em05_lb200_20.csv,"[{""node"": 0, ""type"": ""leaf"", ""model"": ""llama3-chatqa:8b"", ""prompt"": ""Question: For how many years was the original Omsund Bridge in Kristiansund, Norway, in use?\n\nProvide the accurate answer directly.\n\nOutput (nothing else):"", ""raw_output"": ""70"", ""output"": ""70"", ""input_tokens"": 34, ""output_tokens"": 1}, {""node"": 1, ""type"": ""verification"", ""model"": ""mistral:7b"", ""prompt"": ""Question: For how many years was the original Omsund Bridge in Kristiansund, Norway, in use?\n\nAnswer to verify: 70\n\nTask: Verify accuracy.\n\nRules:\n- If correct, output it exactly as given\n- If wrong, provide correct answer\n- Be concise and direct\n\nOutput (nothing else):"", ""parent_output"": ""70"", ""raw_output"": ""Correct"", ""output"": ""Correct"", ""input_tokens"": 66, ""output_tokens"": 1}]",1,0.2095615565776825
F,E,Genetic characteristics of the bunyavirus family include which one of the following? A) Emerging viruses via arthropod vector B) Single-stranded DNA viruses C) Viruses that primarily infect plants D) Viruses using a DNA-dependent RNA polymerase E) Viruses with a positive-sense RNA F) Three segmented negative stranded RNA viruses with anti-sense expression G) Viruses that only infect bacteria H) Highly mutable RNA viruses I) Use an RT enzyme J) Double-stranded RNA viruses Above are multiple-choice questions (with answers) related to health. Respond with the option letter only. Example: F. Do not include any other text or explanation.,0.2008751034736633,health_mmlu,5.272e-06,18.605081,28.636957,"(0,)",results_health_mmlu,7.2276e-06,25.1116624,1,38.6518928,"[([0], ['mistral:7b'])]",0.6433739781379699,health_mmlu,7951.484551906586,qoa_results_health_mmlu_pop200_gen200_add0p3_flip0p1_mut0p3_level4_bound5_cb1p22em05_lb200_20.csv,"[{""node"": 0, ""type"": ""leaf"", ""model"": ""mistral:7b"", ""prompt"": ""Question: Genetic characteristics of the bunyavirus family include which one of the following? A) Emerging viruses via arthropod vector B) Single-stranded DNA viruses C) Viruses that primarily infect plants D) Viruses using a DNA-dependent RNA polymerase E) Viruses with a positive-sense RNA F) Three segmented negative stranded RNA viruses with anti-sense expression G) Viruses that only infect bacteria H) Highly mutable RNA viruses I) Use an RT enzyme J) Double-stranded RNA viruses Above are multiple-choice questions (with answers) related to health. Respond with the option letter only. Example: F. Do not include any other text or explanation.\n\nSelect the correct answer.\n\nFormat: \""the answer is X)Option text.\""\nExample: \""the answer is C)Hypertension.\""\n\nOutput (nothing else):"", ""raw_output"": ""E) Positive-sense RNA"", ""output"": ""the answer is E) Positive-sense RNA."", ""input_tokens"": 169, ""output_tokens"": 10}]",0,0.0
A,H,"Given image \begin{tabular}{|llll|} \hline 7 & 1 & 6 & 0 \\ 3 & 3 & 7 & 6 \\ 6 & 6 & 5 & 7 \\ \hline \end{tabular} , and the bit-depth of the image is 4. Suppose you want to use the thresholding technique to segment the image. What is the appropriate threshold value based on the histogram of the image? Follow the following rule when you do thresholding or grouping: pixel $(i, j) \in$ Group A pixels if $g(i, j) \leq$ current threshold $\mathrm{T}$; pixel $(i, j) \in$ Group B pixels otherwise, where $g(i, j)$ is the intensity value of pixel $(i, j)$. A) 4 B) 6 C) 8 D) 9 E) 1 F) 7 G) 5 H) 2 I) 3 J) 0 Above are multiple-choice questions (with answers) related to computer science. Respond with the option letter only. Example: F. Do not include any other text or explanation.",0.3873400092124939,computer science_mmlu,8.386e-06,30.454127,46.875019,"(0,)",results_computer_science_mmlu,8.5826e-06,28.2402263,1,43.4673811,"[([0], ['mistral:7b'])]",0.8209844350814819,computer science_mmlu,9546.104326486588,qoa_results_computer_science_mmlu_pop200_gen200_add0p3_flip0p1_mut0p3_level4_bound5_cb1p22em05_lb200_20.csv,"[{""node"": 0, ""type"": ""leaf"", ""model"": ""mistral:7b"", ""prompt"": ""Question: Given image \\begin{tabular}{|llll|} \\hline 7 & 1 & 6 & 0 \\\\ 3 & 3 & 7 & 6 \\\\ 6 & 6 & 5 & 7 \\\\ \\hline \\end{tabular} , and the bit-depth of the image is 4. Suppose you want to use the thresholding technique to segment the image. What is the appropriate threshold value based on the histogram of the image? Follow the following rule when you do thresholding or grouping: pixel $(i, j) \\in$ Group A pixels if $g(i, j) \\leq$ current threshold $\\mathrm{T}$; pixel $(i, j) \\in$ Group B pixels otherwise, where $g(i, j)$ is the intensity value of pixel $(i, j)$. A) 4 B) 6 C) 8 D) 9 E) 1 F) 7 G) 5 H) 2 I) 3 J) 0 Above are multiple-choice questions (with answers) related to computer science. Respond with the option letter only. Example: F. Do not include any other text or explanation.\n\nSelect the correct answer.\n\nFormat: \""the answer is X)Option text.\""\nExample: \""the answer is C)Hypertension.\""\n\nOutput (nothing else):"", ""raw_output"": ""the answer is H) 2"", ""output"": ""the answer is H) 2"", ""input_tokens"": 286, ""output_tokens"": 7}]",0,0.0
H,H,Hormones are secreted: A) into the tissues surrounding the glands where they were manufactured B) into the stomach and then are digested and travel throughout the body C) into the brain for processing before being distributed D) into the ovaries and testes E) into the hair follicles and travel along the hair shafts F) into the skin and absorbed through the pores G) into the air and inhaled by the individual H) directly into the bloodstream I) into the saliva and are swallowed and digested J) into the lymphatic system Above are multiple-choice questions (with answers) related to other. Respond with the option letter only. Example: F. Do not include any other text or explanation.,1.0,other_mmlu,5.526e-06,19.644471000000003,30.236787,"(0,)",results_other_mmlu,8.2142e-06,23.5525774,1,36.2521478,"[([0], ['mistral:7b'])]",0.7015748888254165,other_mmlu,6959.505929708481,qoa_results_other_mmlu_pop200_gen200_add0p3_flip0p1_mut0p3_level4_bound5_cb1p22em05_lb200_20.csv,"[{""node"": 0, ""type"": ""leaf"", ""model"": ""mistral:7b"", ""prompt"": ""Question: Hormones are secreted: A) into the tissues surrounding the glands where they were manufactured B) into the stomach and then are digested and travel throughout the body C) into the brain for processing before being distributed D) into the ovaries and testes E) into the hair follicles and travel along the hair shafts F) into the skin and absorbed through the pores G) into the air and inhaled by the individual H) directly into the bloodstream I) into the saliva and are swallowed and digested J) into the lymphatic system Above are multiple-choice questions (with answers) related to other. Respond with the option letter only. Example: F. Do not include any other text or explanation.\n\nSelect the correct answer.\n\nFormat: \""the answer is X)Option text.\""\nExample: \""the answer is C)Hypertension.\""\n\nOutput (nothing else):"", ""raw_output"": ""the answer is H) directly into the bloodstream"", ""output"": ""the answer is H) directly into the bloodstream"", ""input_tokens"": 180, ""output_tokens"": 9}]",0,1.0
G,G,How can you describe the thinking and outlook of transformational leaders? A) Functional B) Tactical C) Narrow-minded D) Transactional E) Operational F) Procedural G) Strategic H) Micromanaging I) Reactive J) Developmental Above are multiple-choice questions (with answers) related to business. Respond with the option letter only. Example: F. Do not include any other text or explanation.,1.0,business_mmlu,8.819999999999999e-06,8.434187999999999,12.077352,"(3,)",results_business_mmlu,1.0128e-05,9.6926224,1,13.8793696,"[([0], ['qwen2.5:14b'])]",0.79641273021698,business_mmlu,5612.857029676437,qoa_results_business_mmlu_pop200_gen200_add0p3_flip0p1_mut0p3_level4_bound5_cb1p22em05_lb19.47_20.csv,"[{""node"": 0, ""type"": ""leaf"", ""model"": ""qwen2.5:14b"", ""prompt"": ""Question: How can you describe the thinking and outlook of transformational leaders? A) Functional B) Tactical C) Narrow-minded D) Transactional E) Operational F) Procedural G) Strategic H) Micromanaging I) Reactive J) Developmental Above are multiple-choice questions (with answers) related to business. Respond with the option letter only. Example: F. Do not include any other text or explanation.\n\nSelect the correct answer.\n\nFormat: \""the answer is X)Option text.\""\nExample: \""the answer is C)Hypertension.\""\n\nOutput (nothing else):"", ""raw_output"": ""the answer is G) Strategic."", ""output"": ""the answer is G) Strategic."", ""input_tokens"": 119, ""output_tokens"": 7}]",0,1.0
2,Five,How many Targaryen kings had sat on the throne before Maegor the Cruel?,0.5544723272323608,TV shows,3.13e-06,2.8367219999999995,2.03711,"(4,)",results_tv_shows,1.1682e-05,10.595991,1,7.609205,"[([0], ['gemma3:27b'])]",0.6727710008621216,TV shows,4102.664754152298,qoa_results_tv_shows_pop200_gen200_add0p3_flip0p1_mut0p3_level4_bound5_cb1p22em05_lb19.47_20.csv,"[{""node"": 0, ""type"": ""leaf"", ""model"": ""gemma3:27b"", ""prompt"": ""Question: How many Targaryen kings had sat on the throne before Maegor the Cruel?\n\nProvide the accurate answer directly.\n\nOutput (nothing else):"", ""raw_output"": ""Five"", ""output"": ""Five"", ""input_tokens"": 33, ""output_tokens"": 1}]",0,0.5544724464416504
168,237 acres,How many acres did the University of Alabama purchase to expand its campus in 2010?,0.3649922311306,Other,3.11e-06,2.753289,1.9771950000000005,"(4,)",results_other,1.1863e-05,10.679424,1,7.669120000000001,"[([0], ['gemma3:27b'])]",0.3555575951933861,Other,7130.553217172623,qoa_results_other_pop200_gen200_add0p3_flip0p1_mut0p3_level4_bound5_cb1p22em05_lb19.47_20.csv,"[{""node"": 0, ""type"": ""leaf"", ""model"": ""gemma3:27b"", ""prompt"": ""Question: How many acres did the University of Alabama purchase to expand its campus in 2010?\n\nProvide the accurate answer directly.\n\nOutput (nothing else):"", ""raw_output"": ""237 acres"", ""output"": ""237 acres"", ""input_tokens"": 31, ""output_tokens"": 2}]",0,0.3649922609329223
27,Correct,How many mountaineers were killed in the avalanche in Uttarkashi on 4 October 2022?,0.2576392292976379,Geography,5.204e-06,16.422362,25.277314,"(0, 0)",results_geography,8.774666666666667e-06,30.83523666666667,1,47.46162333333333,"[([0, 1], ['mistral:7b', 'mistral:7b'])]",0.4909502118825912,Geography,14552.033256530762,qoa_results_geography_pop200_gen200_add0p3_flip0p1_mut0p3_level4_bound5_cb1p22em05_lb200_20.csv,"[{""node"": 0, ""type"": ""leaf"", ""model"": ""mistral:7b"", ""prompt"": ""Question: How many mountaineers were killed in the avalanche in Uttarkashi on 4 October 2022?\n\nProvide the accurate answer directly.\n\nOutput (nothing else):"", ""raw_output"": ""As of my last update, there is no reported avalanche incident involving mountaineers in Uttarkashi on October 4, 2022. I recommend checking recent news sources for the most accurate and up-to-date information."", ""output"": ""As of my last update, there is no reported avalanche incident involving mountaineers in Uttarkashi on October 4, 2022."", ""input_tokens"": 35, ""output_tokens"": 29}, {""node"": 1, ""type"": ""verification"", ""model"": ""mistral:7b"", ""prompt"": ""Question: How many mountaineers were killed in the avalanche in Uttarkashi on 4 October 2022?\n\nAnswer to verify: As of my last update, there is no reported avalanche incident involving mountaineers in Uttarkashi on October 4, 2022.\n\nTask: Verify accuracy.\n\nRules:\n- If correct, output it exactly as given\n- If wrong, provide correct answer\n- Be concise and direct\n\nOutput (nothing else):"", ""parent_output"": ""As of my last update, there is no reported avalanche incident involving mountaineers in Uttarkashi on October 4, 2022."", ""raw_output"": ""Correct"", ""output"": ""Correct"", ""input_tokens"": 93, ""output_tokens"": 1}]",1,0.2576391696929931
6,3,How many of Jacob Abraham Camille Pissarro's seven children also became painters?,0.7423207759857178,Art,2.04e-06,2.075078,2.971412,"(3,)",results_art,8.819999999999999e-06,9.0165486,1,12.911264400000002,"[([0], ['qwen2.5:14b'])]",0.4763900198042393,Art,11775.491151809692,qoa_results_art_pop200_gen200_add0p3_flip0p1_mut0p3_level4_bound5_cb1p22em05_lb19.47_20.csv,"[{""node"": 0, ""type"": ""leaf"", ""model"": ""qwen2.5:14b"", ""prompt"": ""Question: How many of Jacob Abraham Camille Pissarro's seven children also became painters?\n\nProvide the accurate answer directly.\n\nOutput (nothing else):"", ""raw_output"": ""3"", ""output"": ""3"", ""input_tokens"": 30, ""output_tokens"": 1}]",0,0.742320716381073
11 years.,16,How old was Clint Ballard Jr. when he attended a musical program for gifted students at the University of North Texas?,0.3849919438362121,Music,3.4e-06,3.087021,2.216855,"(4,)",results_music,1.1357e-05,10.3206621,1,7.4114855,"[([0], ['gemma3:27b'])]",0.4612290024757385,Music,8730.395790100098,qoa_results_music_pop200_gen200_add0p3_flip0p1_mut0p3_level4_bound5_cb1p22em05_lb19.47_20.csv,"[{""node"": 0, ""type"": ""leaf"", ""model"": ""gemma3:27b"", ""prompt"": ""Question: How old was Clint Ballard Jr. when he attended a musical program for gifted students at the University of North Texas?\n\nProvide the accurate answer directly.\n\nOutput (nothing else):"", ""raw_output"": ""16"", ""output"": ""16"", ""input_tokens"": 36, ""output_tokens"": 1}]",0,0.3849919438362121
"Dear Raja Sahib,",His Highness Sriman Raja Mohendra Pratap,"How was Raja Mohendra Pratap addressed in the salutation of the letter sent by Abhay Charan De, also known as A. C. Bhaktivedanta Swami Prabhupada, on July 13, 1947?",0.6014912128448486,History,7.93e-06,6.507774,4.67337,"(4,)",results_history,1.204e-05,10.9213797,1,7.8428735,"[([0], ['gemma3:27b'])]",0.4643924385309219,History,3943.85196852684,qoa_results_history_pop200_gen200_add0p3_flip0p1_mut0p3_level4_bound5_cb1p22em05_lb19.47_20.csv,"[{""node"": 0, ""type"": ""leaf"", ""model"": ""gemma3:27b"", ""prompt"": ""Question: How was Raja Mohendra Pratap addressed in the salutation of the letter sent by Abhay Charan De, also known as A. C. Bhaktivedanta Swami Prabhupada, on July 13, 1947?\n\nProvide the accurate answer directly.\n\nOutput (nothing else):"", ""raw_output"": ""His Highness Sriman Raja Mohendra Pratap"", ""output"": ""His Highness Sriman Raja Mohendra Pratap"", ""input_tokens"": 65, ""output_tokens"": 13}]",0,0.6014910936355591
F,F,"If Young's Modulus for steel is 19 × 10^11 dynes/cm^2, how much force will be required to stretch a sample of wire 1 sq mm in cross section by 0.2% of its original length? A) 22 × 10^8 dynes B) 14 × 10^8 dynes C) 23 × 10^8 dynes D) 21 × 10^8 dynes E) 16 × 10^8 dynes F) 19 × 10^8 dynes G) 18 × 10^8 dynes H) 20 × 10^8 dynes I) 17 × 10^8 dynes J) 15 × 10^8 dynes Above are multiple-choice questions (with answers) related to physics. Respond with the option letter only. Example: F. Do not include any other text or explanation.",1.0,physics_mmlu,1.3365000000000002e-05,25.64136,36.45,"(1,)",results_physics_mmlu,1.060125e-05,20.33898,1,28.9125,"[([0], ['llama3-chatqa:8b'])]",0.5946611985564232,physics_mmlu,5619.190279006958,qoa_results_physics_mmlu_pop200_gen200_add0p3_flip0p1_mut0p3_level4_bound5_cb1p22em05_lb200_20.csv,"[{""node"": 0, ""type"": ""leaf"", ""model"": ""llama3-chatqa:8b"", ""prompt"": ""Question: If Young's Modulus for steel is 19 \u00d7 10^11 dynes/cm^2, how much force will be required to stretch a sample of wire 1 sq mm in cross section by 0.2% of its original length? A) 22 \u00d7 10^8 dynes B) 14 \u00d7 10^8 dynes C) 23 \u00d7 10^8 dynes D) 21 \u00d7 10^8 dynes E) 16 \u00d7 10^8 dynes F) 19 \u00d7 10^8 dynes G) 18 \u00d7 10^8 dynes H) 20 \u00d7 10^8 dynes I) 17 \u00d7 10^8 dynes J) 15 \u00d7 10^8 dynes Above are multiple-choice questions (with answers) related to physics. Respond with the option letter only. Example: F. Do not include any other text or explanation.\n\nSelect the correct answer.\n\nFormat: \""the answer is X)Option text.\""\nExample: \""the answer is C)Hypertension.\""\n\nOutput (nothing else):"", ""raw_output"": ""the answer is F)19 \u00d7 10^8 dynes"", ""output"": ""the answer is F)19 \u00d7 10^8 dynes"", ""input_tokens"": 230, ""output_tokens"": 13}]",0,1.0
G,G,"If adverse impact on some minority group has been observed, which of the following types of tests probably has the best chance of withstanding legal challenge A) Projective B) Empirically keyed C) Personality test D) Multiple-choice E) Computer adaptive test F) Integrity test G) Work sample H) Situational judgement test I) Cognitive ability test J) Polygraph test Above are multiple-choice questions (with answers) related to psychology. Respond with the option letter only. Example: F. Do not include any other text or explanation.",1.0,psychology_mmlu,1.062e-05,10.241514,14.665356,"(3,)",results_psychology_mmlu,1.1934e-05,11.0648514,1,15.8443356,"[([0], ['qwen2.5:14b'])]",0.9034036934375764,psychology_mmlu,8909.346123933792,qoa_results_psychology_mmlu_pop200_gen200_add0p3_flip0p1_mut0p3_level4_bound5_cb1p22em05_lb200_20.csv,"[{""node"": 0, ""type"": ""leaf"", ""model"": ""qwen2.5:14b"", ""prompt"": ""Question: If adverse impact on some minority group has been observed, which of the following types of tests probably has the best chance of withstanding legal challenge A) Projective B) Empirically keyed C) Personality test D) Multiple-choice E) Computer adaptive test F) Integrity test G) Work sample H) Situational judgement test I) Cognitive ability test J) Polygraph test Above are multiple-choice questions (with answers) related to psychology. Respond with the option letter only. Example: F. Do not include any other text or explanation.\n\nSelect the correct answer.\n\nFormat: \""the answer is X)Option text.\""\nExample: \""the answer is C)Hypertension.\""\n\nOutput (nothing else):"", ""raw_output"": ""the answer is G)Work sample."", ""output"": ""the answer is G)Work sample."", ""input_tokens"": 145, ""output_tokens"": 8}]",0,1.0
G,A,"If p(x) is the minimal-degree interpolating polynomial for the real-valued function f(x) at the n + 1 distinct real numbers x0, .... xn what is the maximum possible degree of p(x)? A) 2n B) n + 1 C) 2n + 1 D) n³ E) n² + 1 F) n/2 G) n H) n - 1 I) n² J) n + 2 Above are multiple-choice questions (with answers) related to computer science. Respond with the option letter only. Example: F. Do not include any other text or explanation.",0.2313934117555618,computer science_mmlu,5.19e-06,18.397203,28.316991,"(0,)",results_computer_science_mmlu,8.5826e-06,28.2402263,1,43.4673811,"[([0], ['mistral:7b'])]",0.8209844350814819,computer science_mmlu,9546.104326486588,qoa_results_computer_science_mmlu_pop200_gen200_add0p3_flip0p1_mut0p3_level4_bound5_cb1p22em05_lb200_20.csv,"[{""node"": 0, ""type"": ""leaf"", ""model"": ""mistral:7b"", ""prompt"": ""Question: If p(x) is the minimal-degree interpolating polynomial for the real-valued function f(x) at the n + 1 distinct real numbers x0, .... xn what is the maximum possible degree of p(x)? A) 2n B) n + 1 C) 2n + 1 D) n\u00b3 E) n\u00b2 + 1 F) n/2 G) n H) n - 1 I) n\u00b2 J) n + 2 Above are multiple-choice questions (with answers) related to computer science. Respond with the option letter only. Example: F. Do not include any other text or explanation.\n\nSelect the correct answer.\n\nFormat: \""the answer is X)Option text.\""\nExample: \""the answer is C)Hypertension.\""\n\nOutput (nothing else):"", ""raw_output"": ""The answer is A) 2n."", ""output"": ""the answer is A) 2n."", ""input_tokens"": 168, ""output_tokens"": 9}]",0,0.0
A,A,"In BASIC the RND function is used to generate a random number between 0 and 1. What statements would you use to: (a) generate integral random number between 0 and X - 1? (b) generate integral random number between 1 and X? (c) simulate the toss of a cubical die? (d) simulate a binary random choice taking values 1 or 2? A) (a) LET T = INT(X*RND), (b) LET V = INT(1 + X*RND), (c) LET W = INT(1 + 6*RND), (d) LET N = INT(1 + 2*RND) B) (a) LET T = INT(RND/X), (b) LET V = INT(1 + RND/X), (c) LET W = INT(1 + RND/6), (d) LET N = INT(1 + RND/2) C) (a) LET T = INT(RND*(X-1)+1), (b) LET V = INT(RND*X), (c) LET W = INT(6*RND), (d) LET N = INT(2*RND) D) (a) LET T = INT((X-1) * RND), (b) LET V = INT(X * RND) + 1, (c) LET W = INT(5 * RND) + 1, (d) LET N = INT(RND) + 1 E) (a) LET T = RND(X), (b) LET V = 1+RND(X), (c) LET W = 1+RND(6), (d) LET N = 1+RND(2) F) (a) LET T = INT(X * (RND + 1)), (b) LET V = INT((X + 1) * RND), (c) LET W = INT((6 + 1) * RND), (d) LET N = INT((2 + 1) * RND) G) (a) LET T = RND*(X-1), (b) LET V = 1 + RND*X, (c) LET W = 1 + RND*6, (d) LET N = 1 + RND*2 H) (a) LET T = INT(RND * (X - 1)), (b) LET V = INT(RND * X) + 1, (c) LET W = INT(RND * 5) + 1, (d) LET N = INT(RND * 1) + 1 I) (a) LET T = INT(X+RND), (b) LET V = INT(X+RND), (c) LET W = INT(6+RND), (d) LET N = INT(2+RND) Above are multiple-choice questions (with answers) related to computer science. Respond with the option letter only. Example: F. Do not include any other text or explanation.",1.0,computer science_mmlu,2.2308e-05,77.018799,118.547403,"(0,)",results_computer_science_mmlu,8.5826e-06,28.2402263,1,43.4673811,"[([0], ['mistral:7b'])]",0.8209844350814819,computer science_mmlu,9546.104326486588,qoa_results_computer_science_mmlu_pop200_gen200_add0p3_flip0p1_mut0p3_level4_bound5_cb1p22em05_lb200_20.csv,"[{""node"": 0, ""type"": ""leaf"", ""model"": ""mistral:7b"", ""prompt"": ""Question: In BASIC the RND function is used to generate a random number between 0 and 1. What statements would you use to: (a) generate integral random number between 0 and X - 1? (b) generate integral random number between 1 and X? (c) simulate the toss of a cubical die? (d) simulate a binary random choice taking values 1 or 2? A) (a) LET T = INT(X*RND), (b) LET V = INT(1 + X*RND), (c) LET W = INT(1 + 6*RND), (d) LET N = INT(1 + 2*RND) B) (a) LET T = INT(RND/X), (b) LET V = INT(1 + RND/X), (c) LET W = INT(1 + RND/6), (d) LET N = INT(1 + RND/2) C) (a) LET T = INT(RND*(X-1)+1), (b) LET V = INT(RND*X), (c) LET W = INT(6*RND), (d) LET N = INT(2*RND) D) (a) LET T = INT((X-1) * RND), (b) LET V = INT(X * RND) + 1, (c) LET W = INT(5 * RND) + 1, (d) LET N = INT(RND) + 1 E) (a) LET T = RND(X), (b) LET V = 1+RND(X), (c) LET W = 1+RND(6), (d) LET N = 1+RND(2) F) (a) LET T = INT(X * (RND + 1)), (b) LET V = INT((X + 1) * RND), (c) LET W = INT((6 + 1) * RND), (d) LET N = INT((2 + 1) * RND) G) (a) LET T = RND*(X-1), (b) LET V = 1 + RND*X, (c) LET W = 1 + RND*6, (d) LET N = 1 + RND*2 H) (a) LET T = INT(RND * (X - 1)), (b) LET V = INT(RND * X) + 1, (c) LET W = INT(RND * 5) + 1, (d) LET N = INT(RND * 1) + 1 I) (a) LET T = INT(X+RND), (b) LET V = INT(X+RND), (c) LET W = INT(6+RND), (d) LET N = INT(2+RND) Above are multiple-choice questions (with answers) related to computer science. Respond with the option letter only. Example: F. Do not include any other text or explanation.\n\nSelect the correct answer.\n\nFormat: \""the answer is X)Option text.\""\nExample: \""the answer is C)Hypertension.\""\n\nOutput (nothing else):"", ""raw_output"": ""A) (a) LET T = INT(X*RND), (b) LET V = INT(1 + X*RND), (c) LET W = INT(1 + 6*RND), (d) LET N = INT(1 + 2*RND)"", ""output"": ""the answer is A) (a) LET T = INT(X*RND), (b) LET V = INT(1 + X*RND), (c) LET W = INT(1 + 6*RND), (d) LET N = INT(1 + 2*RND)."", ""input_tokens"": 681, ""output_tokens"": 60}]",0,1.0
