Annotated Answer,Final_Output,Original_Query,Quality_of_Answer,Query Type,Total_Cost,Total_Energy,Total_Latency,assignment,category,cost,energy,iteration,latency,plan,qoa,query_type,run_time_seconds,source_file,step_logs,struct_id,New_QoA_Score
"14,805.65",Correct,What is the forest cover area of Uttar Pradesh in square kilometers according to the India State of Forest Report 2019?,0.082091100513935,Geography,4.241999999999999e-06,11.704408,17.518776,"(1, 0)",results_geography,1.1672333333333332e-05,30.131003000000003,1,44.83388433333334,"[([0, 1], ['llama3-chatqa:8b', 'mistral:7b'])]",0.3783546984195709,Geography,14552.033256530762,qoa_results_geography_pop200_gen200_add0p3_flip0p1_mut0p3_level4_bound5_cb1p22em05_lb200_20.csv,"[{""node"": 0, ""type"": ""leaf"", ""model"": ""llama3-chatqa:8b"", ""prompt"": ""Question: What is the forest cover area of Uttar Pradesh in square kilometers according to the India State of Forest Report 2019?\n\nProvide the accurate answer directly.\n\nOutput (nothing else):"", ""raw_output"": ""42,000"", ""output"": ""42,000"", ""input_tokens"": 37, ""output_tokens"": 3}, {""node"": 1, ""type"": ""verification"", ""model"": ""mistral:7b"", ""prompt"": ""Question: What is the forest cover area of Uttar Pradesh in square kilometers according to the India State of Forest Report 2019?\n\nAnswer to verify: 42,000\n\nTask: Verify accuracy.\n\nRules:\n- If correct, output it exactly as given\n- If wrong, provide correct answer\n- Be concise and direct\n\nOutput (nothing else):"", ""parent_output"": ""42,000"", ""raw_output"": ""Correct"", ""output"": ""Correct"", ""input_tokens"": 71, ""output_tokens"": 1}]",1,0.0820910260081291
Rachell Marie Hofstetter,Rachell Marie Hofstetter,"What is the full name of the streamer Valkyrae, an American live streamer and YouTuber?",1.0,Video games,4.45e-06,3.671052,2.63626,"(4,)",results_video_games,1.1905e-05,10.7378271,1,7.7110605,"[([0], ['gemma3:27b'])]",0.4877739816904068,Video games,4065.018641471863,qoa_results_video_games_pop200_gen200_add0p3_flip0p1_mut0p3_level4_bound5_cb1p22em05_lb19.47_20.csv,"[{""node"": 0, ""type"": ""leaf"", ""model"": ""gemma3:27b"", ""prompt"": ""Question: What is the full name of the streamer Valkyrae, an American live streamer and YouTuber?\n\nProvide the accurate answer directly.\n\nOutput (nothing else):"", ""raw_output"": ""Rachell Marie Hofstetter"", ""output"": ""Rachell Marie Hofstetter"", ""input_tokens"": 37, ""output_tokens"": 7}]",0,0.9999999403953552
40,5000kHz,What is the master clock frequency of the Toshiba BC-1411 in kilohertz?,0.2725341022014618,Science and technology,2.58e-06,2.275892,3.2589680000000003,"(3,)",results_science_and_technology,9.053999999999998e-06,9.2575254,1,13.2563316,"[([0], ['qwen2.5:14b'])]",0.494495603442192,Science and technology,5245.709873199463,qoa_results_science_and_technology_pop200_gen200_add0p3_flip0p1_mut0p3_level4_bound5_cb1p22em05_lb19.47_20.csv,"[{""node"": 0, ""type"": ""leaf"", ""model"": ""qwen2.5:14b"", ""prompt"": ""Question: What is the master clock frequency of the Toshiba BC-1411 in kilohertz?\n\nProvide the accurate answer directly.\n\nOutput (nothing else):"", ""raw_output"": ""5000kHz"", ""output"": ""5000kHz"", ""input_tokens"": 31, ""output_tokens"": 3}]",0,0.2725341320037842
"A Walk in Andante, 1:18","Dearly Beloved - Reprise, 2:33",What is the name and length of the 12th song on the original Kingdom Hearts I soundtrack?,0.3246151804924011,Video games,4.890000000000001e-06,3.754485,2.696175,"(4,)",results_video_games,1.1905e-05,10.7378271,1,7.7110605,"[([0], ['gemma3:27b'])]",0.4877739816904068,Video games,4065.018641471863,qoa_results_video_games_pop200_gen200_add0p3_flip0p1_mut0p3_level4_bound5_cb1p22em05_lb19.47_20.csv,"[{""node"": 0, ""type"": ""leaf"", ""model"": ""gemma3:27b"", ""prompt"": ""Question: What is the name and length of the 12th song on the original Kingdom Hearts I soundtrack?\n\nProvide the accurate answer directly.\n\nOutput (nothing else):"", ""raw_output"": ""Dearly Beloved - Reprise, 2:33"", ""output"": ""Dearly Beloved - Reprise, 2:33"", ""input_tokens"": 33, ""output_tokens"": 12}]",0,0.3246151804924011
"""Theme of Metal City""",Sweet Station,What is the name of Track 10 on the Sonic Free Riders Original Soundtrack released in 2010?,0.2253183424472808,Video games,3.47e-06,3.087021,2.216855,"(4,)",results_video_games,1.1905e-05,10.7378271,1,7.7110605,"[([0], ['gemma3:27b'])]",0.4877739816904068,Video games,4065.018641471863,qoa_results_video_games_pop200_gen200_add0p3_flip0p1_mut0p3_level4_bound5_cb1p22em05_lb19.47_20.csv,"[{""node"": 0, ""type"": ""leaf"", ""model"": ""gemma3:27b"", ""prompt"": ""Question: What is the name of Track 10 on the Sonic Free Riders Original Soundtrack released in 2010?\n\nProvide the accurate answer directly.\n\nOutput (nothing else):"", ""raw_output"": ""Sweet Station"", ""output"": ""Sweet Station"", ""input_tokens"": 35, ""output_tokens"": 2}]",0,0.2253183126449585
CouchPotato,Correct: Vault 7,What is the name of the CIA project whose user guide was published by WikiLeaks on 10 August 2017?,0.1770025640726089,Politics,3.372e-06,11.745107,18.078079,"(0, 0)",results_politics,8.8484e-06,31.9196669,1,49.1307793,"[([0, 1], ['mistral:7b', 'mistral:7b'])]",0.4099815025925636,Politics,12121.952551603315,qoa_results_politics_pop200_gen200_add0p3_flip0p1_mut0p3_level4_bound5_cb1p22em05_lb200_20.csv,"[{""node"": 0, ""type"": ""leaf"", ""model"": ""mistral:7b"", ""prompt"": ""Question: What is the name of the CIA project whose user guide was published by WikiLeaks on 10 August 2017?\n\nProvide the accurate answer directly.\n\nOutput (nothing else):"", ""raw_output"": ""Vault 7"", ""output"": ""Vault 7"", ""input_tokens"": 36, ""output_tokens"": 3}, {""node"": 1, ""type"": ""verification"", ""model"": ""mistral:7b"", ""prompt"": ""Question: What is the name of the CIA project whose user guide was published by WikiLeaks on 10 August 2017?\n\nAnswer to verify: Vault 7\n\nTask: Verify accuracy.\n\nRules:\n- If correct, output it exactly as given\n- If wrong, provide correct answer\n- Be concise and direct\n\nOutput (nothing else):"", ""parent_output"": ""Vault 7"", ""raw_output"": ""Correct: Vault 7"", ""output"": ""Correct: Vault 7"", ""input_tokens"": 69, ""output_tokens"": 5}]",1,0.1770025491714477
Matthew Dubourg,James Cook,"What is the name of the man buried at Paddington Cemetery in London in 1767, with an epitaph that reads, ""Tho' sweet as Orpheus thou couldst bring / Soft pleadings from the trembling string""?",0.4329651296138763,Music,3.4100000000000004e-06,6.54224,9.3,"(1,)",results_music,6.8145000000000006e-06,13.073928,1,18.585,"[([0], ['llama3-chatqa:8b'])]",0.4635770440101623,Music,8730.395790100098,qoa_results_music_pop200_gen200_add0p3_flip0p1_mut0p3_level4_bound5_cb1p22em05_lb19.47_20.csv,"[{""node"": 0, ""type"": ""leaf"", ""model"": ""llama3-chatqa:8b"", ""prompt"": ""Question: What is the name of the man buried at Paddington Cemetery in London in 1767, with an epitaph that reads, \""Tho' sweet as Orpheus thou couldst bring / Soft pleadings from the trembling string\""?\n\nProvide the accurate answer directly.\n\nOutput (nothing else):"", ""raw_output"": ""James Cook"", ""output"": ""James Cook"", ""input_tokens"": 60, ""output_tokens"": 2}]",0,0.4329651594161987
Heavy,Perfect to Me,"What is the name of the ninth track on Anne-Marie's album ""Speak Your Mind""?",0.1805796325206756,Music,3.36e-06,2.920155,2.097025,"(4,)",results_music,1.1357e-05,10.3206621,1,7.4114855,"[([0], ['gemma3:27b'])]",0.4612290024757385,Music,8730.395790100098,qoa_results_music_pop200_gen200_add0p3_flip0p1_mut0p3_level4_bound5_cb1p22em05_lb19.47_20.csv,"[{""node"": 0, ""type"": ""leaf"", ""model"": ""gemma3:27b"", ""prompt"": ""Question: What is the name of the ninth track on Anne-Marie's album \""Speak Your Mind\""?\n\nProvide the accurate answer directly.\n\nOutput (nothing else):"", ""raw_output"": ""Perfect to Me"", ""output"": ""Perfect to Me"", ""input_tokens"": 32, ""output_tokens"": 3}]",0,0.1805796027183532
Pyridine,Benzene,What is the name of the organic compound that William Ramsay first formed in 1876 from acetylene and hydrogen cyanide in an iron tube furnace?,0.4840995073318481,Science and technology,3.4199999999999994e-06,3.213024,4.6008960000000005,"(3,)",results_science_and_technology,9.053999999999998e-06,9.2575254,1,13.2563316,"[([0], ['qwen2.5:14b'])]",0.494495603442192,Science and technology,5245.709873199463,qoa_results_science_and_technology_pop200_gen200_add0p3_flip0p1_mut0p3_level4_bound5_cb1p22em05_lb19.47_20.csv,"[{""node"": 0, ""type"": ""leaf"", ""model"": ""qwen2.5:14b"", ""prompt"": ""Question: What is the name of the organic compound that William Ramsay first formed in 1876 from acetylene and hydrogen cyanide in an iron tube furnace?\n\nProvide the accurate answer directly.\n\nOutput (nothing else):"", ""raw_output"": ""Benzene"", ""output"": ""Benzene"", ""input_tokens"": 45, ""output_tokens"": 3}]",0,0.4840996265411377
Mount Everest,Correct,What is the name of the tallest mountain?,0.1322254687547683,Geography,2.29e-06,8.211181,12.638656999999998,"(0, 0)",results_geography,8.774666666666667e-06,30.83523666666667,1,47.46162333333333,"[([0, 1], ['mistral:7b', 'mistral:7b'])]",0.4909502118825912,Geography,14552.033256530762,qoa_results_geography_pop200_gen200_add0p3_flip0p1_mut0p3_level4_bound5_cb1p22em05_lb200_20.csv,"[{""node"": 0, ""type"": ""leaf"", ""model"": ""mistral:7b"", ""prompt"": ""Question: What is the name of the tallest mountain?\n\nProvide the accurate answer directly.\n\nOutput (nothing else):"", ""raw_output"": ""Mount Everest"", ""output"": ""Mount Everest"", ""input_tokens"": 22, ""output_tokens"": 2}, {""node"": 1, ""type"": ""verification"", ""model"": ""mistral:7b"", ""prompt"": ""Question: What is the name of the tallest mountain?\n\nAnswer to verify: Mount Everest\n\nTask: Verify accuracy.\n\nRules:\n- If correct, output it exactly as given\n- If wrong, provide correct answer\n- Be concise and direct\n\nOutput (nothing else):"", ""parent_output"": ""Mount Everest"", ""raw_output"": ""Correct"", ""output"": ""Correct"", ""input_tokens"": 54, ""output_tokens"": 1}]",1,0.1322254538536071
Mark's wife.,"Ms. Casey's secret identity in Season 1 of Severance is Katie, the main protagonist's wife.",What is the secret identity of Ms. Casey in Season 1 of Severance?,0.3984306454658508,TV shows,7.079999999999999e-06,3.480776,4.984304,"(3,)",results_tv_shows,8.22e-06,8.487738400000001,1,12.154033600000002,"[([0], ['qwen2.5:14b'])]",0.6060403883457184,TV shows,4102.664754152298,qoa_results_tv_shows_pop200_gen200_add0p3_flip0p1_mut0p3_level4_bound5_cb1p22em05_lb19.47_20.csv,"[{""node"": 0, ""type"": ""leaf"", ""model"": ""qwen2.5:14b"", ""prompt"": ""Question: What is the secret identity of Ms. Casey in Season 1 of Severance?\n\nProvide the accurate answer directly.\n\nOutput (nothing else):"", ""raw_output"": ""Ms. Casey's secret identity in Season 1 of Severance is Katie, the main protagonist's wife."", ""output"": ""Ms. Casey's secret identity in Season 1 of Severance is Katie, the main protagonist's wife."", ""input_tokens"": 30, ""output_tokens"": 22}]",0,0.3984306454658508
Arrhenius,Dirac,"What is the surname of the individual who won the Faraday Lectureship Prize, previously known simply as the Faraday Lectureship, in 1914?",0.2743498086929321,Science and technology,3.24e-06,3.213024,4.600896,"(3,)",results_science_and_technology,9.053999999999998e-06,9.2575254,1,13.2563316,"[([0], ['qwen2.5:14b'])]",0.494495603442192,Science and technology,5245.709873199463,qoa_results_science_and_technology_pop200_gen200_add0p3_flip0p1_mut0p3_level4_bound5_cb1p22em05_lb19.47_20.csv,"[{""node"": 0, ""type"": ""leaf"", ""model"": ""qwen2.5:14b"", ""prompt"": ""Question: What is the surname of the individual who won the Faraday Lectureship Prize, previously known simply as the Faraday Lectureship, in 1914?\n\nProvide the accurate answer directly.\n\nOutput (nothing else):"", ""raw_output"": ""Dirac"", ""output"": ""Dirac"", ""input_tokens"": 46, ""output_tokens"": 2}]",0,0.2743498086929321
Norris,Davies,What is the surname of the individual who won the Sir George Stokes Award (colloquially the Stokes Medal) in 2001?,0.3093699216842651,Science and technology,3.18e-06,2.945272,4.217488,"(3,)",results_science_and_technology,9.053999999999998e-06,9.2575254,1,13.2563316,"[([0], ['qwen2.5:14b'])]",0.494495603442192,Science and technology,5245.709873199463,qoa_results_science_and_technology_pop200_gen200_add0p3_flip0p1_mut0p3_level4_bound5_cb1p22em05_lb19.47_20.csv,"[{""node"": 0, ""type"": ""leaf"", ""model"": ""qwen2.5:14b"", ""prompt"": ""Question: What is the surname of the individual who won the Sir George Stokes Award (colloquially the Stokes Medal) in 2001?\n\nProvide the accurate answer directly.\n\nOutput (nothing else):"", ""raw_output"": ""Davies"", ""output"": ""Davies"", ""input_tokens"": 41, ""output_tokens"": 3}]",0,0.3093700110912323
O'Reilly,Smith,What is the surname of the winner of the Hickinbottom Award in 2012?,0.2616604566574096,Other,2.95e-06,2.669856,1.91728,"(4,)",results_other,1.1863e-05,10.679424,1,7.669120000000001,"[([0], ['gemma3:27b'])]",0.3555575951933861,Other,7130.553217172623,qoa_results_other_pop200_gen200_add0p3_flip0p1_mut0p3_level4_bound5_cb1p22em05_lb19.47_20.csv,"[{""node"": 0, ""type"": ""leaf"", ""model"": ""gemma3:27b"", ""prompt"": ""Question: What is the surname of the winner of the Hickinbottom Award in 2012?\n\nProvide the accurate answer directly.\n\nOutput (nothing else):"", ""raw_output"": ""Smith"", ""output"": ""Smith"", ""input_tokens"": 31, ""output_tokens"": 1}]",0,0.2616604268550873
Videotape,"Cornelia Parker dissolved fireworks to create the ink for her work ""Pornographic Drawings (1997)"".","What item did Cornelia Parker dissolve to create ink for her work ""Pornographic Drawings (1997)""?",0.1689362525939941,Art,7.199999999999999e-06,3.815466,5.463564000000001,"(3,)",results_art,8.819999999999999e-06,9.0165486,1,12.911264400000002,"[([0], ['qwen2.5:14b'])]",0.4763900198042393,Art,11775.491151809692,qoa_results_art_pop200_gen200_add0p3_flip0p1_mut0p3_level4_bound5_cb1p22em05_lb19.47_20.csv,"[{""node"": 0, ""type"": ""leaf"", ""model"": ""qwen2.5:14b"", ""prompt"": ""Question: What item did Cornelia Parker dissolve to create ink for her work \""Pornographic Drawings (1997)\""?\n\nProvide the accurate answer directly.\n\nOutput (nothing else):"", ""raw_output"": ""Cornelia Parker dissolved fireworks to create the ink for her work \""Pornographic Drawings (1997)\""."", ""output"": ""Cornelia Parker dissolved fireworks to create the ink for her work \""Pornographic Drawings (1997)\""."", ""input_tokens"": 36, ""output_tokens"": 21}]",0,0.1689362525939941
I,G,"What makes the blood flow throughout the body? In what part of the circulatory system does the blood flow most slowly? Why? A) Blood flow is caused by the volume of the blood vessels. B) Blood flow is caused by the expansion and contraction of the blood vessels themselves, and it is slowest in the pulmonary arteries because they have the thickest walls. C) Blood flow is slowest in the arteries due to their smaller size. D) Blood flow is the result of osmotic pressure differences, and it is slowest in the aorta due to high blood pressure. E) Blood flow is generated by the contraction of muscles around the veins, and it is slowest in the arterioles due to their high resistance. F) Blood flow is caused by the gravitational pull on the blood, and it is slowest in the veins because they are closer to the ground. G) Blood flow is driven by the heart pumping blood. H) The rhythmic contractions of the diaphragm cause blood flow, and it is slowest in the venules because they are the narrowest part of the circulation. I) The blood flow throughout the body is caused by the pressure difference that drives the blood through the vessel and the vascular resistance. The blood flow is slowest in the capillaries due to their greater total cross-sectional area. J) Blood flow is driven by the electrical impulses of the body, and it is slowest in the large veins due to their capacitance. Above are multiple-choice questions (with answers) related to biology. Respond with the option letter only. Example: F. Do not include any other text or explanation.",-0.0101713985204696,biology_mmlu,1.1254e-05,40.328332,62.073404,"(0,)",results_biology_mmlu,8.335799999999999e-06,27.9803788,1,43.0674236,"[([0], ['mistral:7b'])]",0.8395025610923768,biology_mmlu,5469.501084327698,qoa_results_biology_mmlu_pop200_gen200_add0p3_flip0p1_mut0p3_level4_bound5_cb1p22em05_lb200_20.csv,"[{""node"": 0, ""type"": ""leaf"", ""model"": ""mistral:7b"", ""prompt"": ""Question: What makes the blood flow throughout the body? In what part of the circulatory system does the blood flow most slowly? Why? A) Blood flow is caused by the volume of the blood vessels. B) Blood flow is caused by the expansion and contraction of the blood vessels themselves, and it is slowest in the pulmonary arteries because they have the thickest walls. C) Blood flow is slowest in the arteries due to their smaller size. D) Blood flow is the result of osmotic pressure differences, and it is slowest in the aorta due to high blood pressure. E) Blood flow is generated by the contraction of muscles around the veins, and it is slowest in the arterioles due to their high resistance. F) Blood flow is caused by the gravitational pull on the blood, and it is slowest in the veins because they are closer to the ground. G) Blood flow is driven by the heart pumping blood. H) The rhythmic contractions of the diaphragm cause blood flow, and it is slowest in the venules because they are the narrowest part of the circulation. I) The blood flow throughout the body is caused by the pressure difference that drives the blood through the vessel and the vascular resistance. The blood flow is slowest in the capillaries due to their greater total cross-sectional area. J) Blood flow is driven by the electrical impulses of the body, and it is slowest in the large veins due to their capacitance. Above are multiple-choice questions (with answers) related to biology. Respond with the option letter only. Example: F. Do not include any other text or explanation.\n\nSelect the correct answer.\n\nFormat: \""the answer is X)Option text.\""\nExample: \""the answer is C)Hypertension.\""\n\nOutput (nothing else):"", ""raw_output"": ""the answer is G) Blood flow is driven by the heart pumping blood."", ""output"": ""the answer is G) Blood flow is driven by the heart pumping blood."", ""input_tokens"": 373, ""output_tokens"": 15}]",0,0.0
"May 19, 2015","November 15th, 2015","What month, day, and year did Ciara perform at the Joy Theater in New Orleans for her Jackie Tour?",0.8055036664009094,Music,2.42e-06,4.64288,6.6,"(1,)",results_music,6.8145000000000006e-06,13.073928,1,18.585,"[([0], ['llama3-chatqa:8b'])]",0.4635770440101623,Music,8730.395790100098,qoa_results_music_pop200_gen200_add0p3_flip0p1_mut0p3_level4_bound5_cb1p22em05_lb19.47_20.csv,"[{""node"": 0, ""type"": ""leaf"", ""model"": ""llama3-chatqa:8b"", ""prompt"": ""Question: What month, day, and year did Ciara perform at the Joy Theater in New Orleans for her Jackie Tour?\n\nProvide the accurate answer directly.\n\nOutput (nothing else):"", ""raw_output"": ""November 15th, 2015"", ""output"": ""November 15th, 2015"", ""input_tokens"": 36, ""output_tokens"": 8}]",0,0.8055036664009094
2 October 1978,"The visit of Feodor Timofeyev, Consul for the Soviet Union in Georgetown, to Jonestown was on November 17-18, 1975.","What month, day, and year did Feodor Timofeyev, consul for the Soviet Union in Georgetown, visit Jonestown for two days and give a speech?",0.2840708494186401,Politics,8.26e-06,23.90597,36.79608999999999,"(0, 0)",results_politics,8.8484e-06,31.9196669,1,49.1307793,"[([0, 1], ['mistral:7b', 'mistral:7b'])]",0.4099815025925636,Politics,12121.952551603315,qoa_results_politics_pop200_gen200_add0p3_flip0p1_mut0p3_level4_bound5_cb1p22em05_lb200_20.csv,"[{""node"": 0, ""type"": ""leaf"", ""model"": ""mistral:7b"", ""prompt"": ""Question: What month, day, and year did Feodor Timofeyev, consul for the Soviet Union in Georgetown, visit Jonestown for two days and give a speech?\n\nProvide the accurate answer directly.\n\nOutput (nothing else):"", ""raw_output"": ""The visit of Feodor Timofeyev, Consul for the Soviet Union in Georgetown, to Jonestown was on November 17-18, 1975."", ""output"": ""The visit of Feodor Timofeyev, Consul for the Soviet Union in Georgetown, to Jonestown was on November 17-18, 1975."", ""input_tokens"": 48, ""output_tokens"": 35}, {""node"": 1, ""type"": ""verification"", ""model"": ""mistral:7b"", ""prompt"": ""Question: What month, day, and year did Feodor Timofeyev, consul for the Soviet Union in Georgetown, visit Jonestown for two days and give a speech?\n\nAnswer to verify: The visit of Feodor Timofeyev, Consul for the Soviet Union in Georgetown, to Jonestown was on November 17-18, 1975.\n\nTask: Verify accuracy.\n\nRules:\n- If correct, output it exactly as given\n- If wrong, provide correct answer\n- Be concise and direct\n\nOutput (nothing else):"", ""parent_output"": ""The visit of Feodor Timofeyev, Consul for the Soviet Union in Georgetown, to Jonestown was on November 17-18, 1975."", ""raw_output"": ""The visit of Feodor Timofeyev, Consul for the Soviet Union in Georgetown, to Jonestown was on November 17-18, 1975. (Correct)"", ""output"": ""The visit of Feodor Timofeyev, Consul for the Soviet Union in Georgetown, to Jonestown was on November 17-18, 1975."", ""input_tokens"": 112, ""output_tokens"": 35}]",1,0.2840708494186401
5 February 2011,"October 4, 2022

(Note: The specific date for this event might vary as my knowledge was last updated in October 2023 and I don't have access to live data or specific events post that.","What month, day, and year did Southeastern Louisiana University retire Robin Roberts' jersey?",0.545153796672821,Sports,8.02e-06,7.5,9.999975,"(2,)",results_sports,9.468e-06,14.3,1,19.066619,"[([0], ['phi4:14b'])]",0.3231358990073203,Sports,4442.241207361221,qoa_results_sports_pop200_gen200_add0p3_flip0p1_mut0p3_level4_bound5_cb1p22em05_lb19.47_20.csv,"[{""node"": 0, ""type"": ""leaf"", ""model"": ""phi4:14b"", ""prompt"": ""Question: What month, day, and year did Southeastern Louisiana University retire Robin Roberts' jersey?\n\nProvide the accurate answer directly.\n\nOutput (nothing else):"", ""raw_output"": ""October 4, 2022\n\n(Note: The specific date for this event might vary as my knowledge was last updated in October 2023 and I don't have access to live data or specific events post that.)"", ""output"": ""October 4, 2022\n\n(Note: The specific date for this event might vary as my knowledge was last updated in October 2023 and I don't have access to live data or specific events post that."", ""input_tokens"": 31, ""output_tokens"": 44}]",0,0.5451538562774658
