Annotated Answer,Final_Output,Original_Query,Quality_of_Answer,Query Type,Total_Cost,Total_Energy,Total_Latency,assignment,category,cost,energy,iteration,latency,plan,qoa,query_type,run_time_seconds,source_file,step_logs,struct_id,New_QoA_Score
E,E,Select the best translation into predicate logic. All jellybeans are sweeter than all fruit. (Fx: x is a fruit; Jx: x is a jellybean; Sxy: x is sweeter than y) A) (∀x)[Jx ⊃ (∀y)(Jy ⊃ Sxy)] B) (∀x)(∀y)[(Fx • Jy) • Sxy] C) (∀x)(∀y)[Sxy ⊃ (Jx • Fy)] D) (∀x)(∀y)[Sxy ⊃ (Fy • Jx)] E) (∀x)[Jx ⊃ (∀y)(Fy ⊃ Sxy)] F) (∀x)(∀y)[(Jx • Fy) ⊃ Sxy] G) (∀x)(∀y)[(Fx • Jy) ⊃ Sxy] H) (∀x)[Fx ⊃ (∀y)(Jy ⊃ Sxy)] I) (∀x)[Fx ⊃ (∀y)(Sxy ⊃ Jy)] J) (∀x)[Jx ⊃ (∀y)(Sxy ⊃ Fy)] Above are multiple-choice questions (with answers) related to philosophy. Respond with the option letter only. Example: F. Do not include any other text or explanation.,1.0,philosophy_mmlu,2.508e-05,23.160548,33.164792000000006,"(3,)",results_philosophy_mmlu,1.1424e-05,10.1344132,1,14.511992800000002,"[([0], ['qwen2.5:14b'])]",0.8662476718425751,philosophy_mmlu,7256.34126996994,qoa_results_philosophy_mmlu_pop200_gen200_add0p3_flip0p1_mut0p3_level4_bound5_cb1p22em05_lb200_20.csv,"[{""node"": 0, ""type"": ""leaf"", ""model"": ""qwen2.5:14b"", ""prompt"": ""Question: Select the best translation into predicate logic. All jellybeans are sweeter than all fruit. (Fx: x is a fruit; Jx: x is a jellybean; Sxy: x is sweeter than y) A) (\u2200x)[Jx \u2283 (\u2200y)(Jy \u2283 Sxy)] B) (\u2200x)(\u2200y)[(Fx \u2022 Jy) \u2022 Sxy] C) (\u2200x)(\u2200y)[Sxy \u2283 (Jx \u2022 Fy)] D) (\u2200x)(\u2200y)[Sxy \u2283 (Fy \u2022 Jx)] E) (\u2200x)[Jx \u2283 (\u2200y)(Fy \u2283 Sxy)] F) (\u2200x)(\u2200y)[(Jx \u2022 Fy) \u2283 Sxy] G) (\u2200x)(\u2200y)[(Fx \u2022 Jy) \u2283 Sxy] H) (\u2200x)[Fx \u2283 (\u2200y)(Jy \u2283 Sxy)] I) (\u2200x)[Fx \u2283 (\u2200y)(Sxy \u2283 Jy)] J) (\u2200x)[Jx \u2283 (\u2200y)(Sxy \u2283 Fy)] Above are multiple-choice questions (with answers) related to philosophy. Respond with the option letter only. Example: F. Do not include any other text or explanation.\n\nSelect the correct answer.\n\nFormat: \""the answer is X)Option text.\""\nExample: \""the answer is C)Hypertension.\""\n\nOutput (nothing else):"", ""raw_output"": ""the answer is E) (\u2200x)[Jx \u2283 (\u2200y)(Fy \u2283 Sxy)]"", ""output"": ""the answer is E) (\u2200x)[Jx \u2283 (\u2200y)(Fy \u2283 Sxy)]."", ""input_tokens"": 322, ""output_tokens"": 24}]",0,1.0
2 Nov 2020,"November 18, 2020","Specify the exact day, month, and year Capcom reported that its servers were affected by ransomware, scrambling its data, and the threat actors, the Ragnar Locker hacker group, had allegedly stolen 1TB of sensitive corporate data and were blackmailing Capcom to pay them to remove the ransomware.",0.8002982139587402,Video games,7.6e-06,6.591206999999999,4.733285,"(4,)",results_video_games,1.1905e-05,10.7378271,1,7.7110605,"[([0], ['gemma3:27b'])]",0.4877739816904068,Video games,4065.018641471863,qoa_results_video_games_pop200_gen200_add0p3_flip0p1_mut0p3_level4_bound5_cb1p22em05_lb19.47_20.csv,"[{""node"": 0, ""type"": ""leaf"", ""model"": ""gemma3:27b"", ""prompt"": ""Question: Specify the exact day, month, and year Capcom reported that its servers were affected by ransomware, scrambling its data, and the threat actors, the Ragnar Locker hacker group, had allegedly stolen 1TB of sensitive corporate data and were blackmailing Capcom to pay them to remove the ransomware.\n\nProvide the accurate answer directly.\n\nOutput (nothing else):"", ""raw_output"": ""November 18, 2020"", ""output"": ""November 18, 2020"", ""input_tokens"": 72, ""output_tokens"": 7}]",0,0.8002982139587402
G,F,"Statement 1| As of 2020, some models attain greater than 98% accuracy on CIFAR-10. Statement 2| The original ResNets were not optimized with the Adam optimizer. A) False, False B) Both statements are somewhat true C) False, True D) Statement 1 is true, Statement 2 is somewhat false E) Statement 1 is false, Statement 2 is mostly true F) Statement 1 is mostly true, Statement 2 is false G) True, True H) Both statements are somewhat false I) True, False J) Statement 1 is mostly false, Statement 2 is true Above are multiple-choice questions (with answers) related to computer science. Respond with the option letter only. Example: F. Do not include any other text or explanation.",0.0987771153450012,computer science_mmlu,6.628e-06,22.866580000000003,35.196259999999995,"(0,)",results_computer_science_mmlu,8.5826e-06,28.2402263,1,43.4673811,"[([0], ['mistral:7b'])]",0.8209844350814819,computer science_mmlu,9546.104326486588,qoa_results_computer_science_mmlu_pop200_gen200_add0p3_flip0p1_mut0p3_level4_bound5_cb1p22em05_lb200_20.csv,"[{""node"": 0, ""type"": ""leaf"", ""model"": ""mistral:7b"", ""prompt"": ""Question: Statement 1| As of 2020, some models attain greater than 98% accuracy on CIFAR-10. Statement 2| The original ResNets were not optimized with the Adam optimizer. A) False, False B) Both statements are somewhat true C) False, True D) Statement 1 is true, Statement 2 is somewhat false E) Statement 1 is false, Statement 2 is mostly true F) Statement 1 is mostly true, Statement 2 is false G) True, True H) Both statements are somewhat false I) True, False J) Statement 1 is mostly false, Statement 2 is true Above are multiple-choice questions (with answers) related to computer science. Respond with the option letter only. Example: F. Do not include any other text or explanation.\n\nSelect the correct answer.\n\nFormat: \""the answer is X)Option text.\""\nExample: \""the answer is C)Hypertension.\""\n\nOutput (nothing else):"", ""raw_output"": ""the answer is F) Statement 1 is mostly true, Statement 2 is false."", ""output"": ""the answer is F) Statement 1 is mostly true, Statement 2 is false."", ""input_tokens"": 202, ""output_tokens"": 18}]",0,0.0
Uttarakhand,Correct,The Alpine musk deer is the state animal of which Indian state?,0.1729711592197418,Geography,3.526e-06,11.641168,17.918096,"(0, 0)",results_geography,8.774666666666667e-06,30.83523666666667,1,47.46162333333333,"[([0, 1], ['mistral:7b', 'mistral:7b'])]",0.4909502118825912,Geography,14552.033256530762,qoa_results_geography_pop200_gen200_add0p3_flip0p1_mut0p3_level4_bound5_cb1p22em05_lb200_20.csv,"[{""node"": 0, ""type"": ""leaf"", ""model"": ""mistral:7b"", ""prompt"": ""Question: The Alpine musk deer is the state animal of which Indian state?\n\nProvide the accurate answer directly.\n\nOutput (nothing else):"", ""raw_output"": ""The Alpine Musk Deer is not the state animal of any Indian state. It's a wild species found in the Himalayas and other mountain ranges. Some states like Jammu and Kashmir have declared the Himalayan Serow, another high-altitude deer, as their state animal."", ""output"": ""The Alpine Musk Deer is not the state animal of any Indian state."", ""input_tokens"": 27, ""output_tokens"": 14}, {""node"": 1, ""type"": ""verification"", ""model"": ""mistral:7b"", ""prompt"": ""Question: The Alpine musk deer is the state animal of which Indian state?\n\nAnswer to verify: The Alpine Musk Deer is not the state animal of any Indian state.\n\nTask: Verify accuracy.\n\nRules:\n- If correct, output it exactly as given\n- If wrong, provide correct answer\n- Be concise and direct\n\nOutput (nothing else):"", ""parent_output"": ""The Alpine Musk Deer is not the state animal of any Indian state."", ""raw_output"": ""Correct"", ""output"": ""Correct"", ""input_tokens"": 70, ""output_tokens"": 1}]",1,0.1729711592197418
F,F,"The Dean was showing a visitor around the campus. The visitor asked, ""About how many students do you have here?"" After a moment of reflection the Dean replied, ""Oh, I'd guess about one in a hundred."" A) Appeal to Authority B) Red Herring C) Denying the Antecedent D) False Dilemma E) Slippery Slope F) Equivocation G) Straw Man H) Fallacy of Division I) Circular Reasoning J) Ad Hominem Above are multiple-choice questions (with answers) related to philosophy. Respond with the option letter only. Example: F. Do not include any other text or explanation.",1.0,philosophy_mmlu,1.236e-05,11.981902,17.157508,"(3,)",results_philosophy_mmlu,1.1424e-05,10.1344132,1,14.511992800000002,"[([0], ['qwen2.5:14b'])]",0.8662476718425751,philosophy_mmlu,7256.34126996994,qoa_results_philosophy_mmlu_pop200_gen200_add0p3_flip0p1_mut0p3_level4_bound5_cb1p22em05_lb200_20.csv,"[{""node"": 0, ""type"": ""leaf"", ""model"": ""qwen2.5:14b"", ""prompt"": ""Question: The Dean was showing a visitor around the campus. The visitor asked, \""About how many students do you have here?\"" After a moment of reflection the Dean replied, \""Oh, I'd guess about one in a hundred.\"" A) Appeal to Authority B) Red Herring C) Denying the Antecedent D) False Dilemma E) Slippery Slope F) Equivocation G) Straw Man H) Fallacy of Division I) Circular Reasoning J) Ad Hominem Above are multiple-choice questions (with answers) related to philosophy. Respond with the option letter only. Example: F. Do not include any other text or explanation.\n\nSelect the correct answer.\n\nFormat: \""the answer is X)Option text.\""\nExample: \""the answer is C)Hypertension.\""\n\nOutput (nothing else):"", ""raw_output"": ""the answer is F)Equivocation."", ""output"": ""the answer is F)Equivocation."", ""input_tokens"": 170, ""output_tokens"": 9}]",0,1.0
I,A,"The Mayan king Yax Pahsaj symbolized his royalty on a stele that depicts: A) a series of decisive military conquests against a rival king. B) a depiction of him as a corn god, a symbol of fertility and prosperity. C) a scene of him hunting and defeating a large jaguar. D) an eagle, a serpent, and a jaguar, all of which were important royal animals. E) him receiving a crown from the Mayan god of death and rebirth. F) his coronation ceremony with all the Mayan gods as witnesses. G) a lightning bolt descending from heaven and marking him as the leader. H) a large sun, symbolizing his role as a son of the Sun God. I) the founder of the dynasty “passing him the torch.” J) him standing on the peak of a mountain to signify his power. Above are multiple-choice questions (with answers) related to history. Respond with the option letter only. Example: F. Do not include any other text or explanation.",0.1114691197872161,history_mmlu,7.946e-06,27.855652000000003,42.875444,"(0,)",results_history_mmlu,6.919799999999999e-06,24.3840894,1,37.5320118,"[([0], ['mistral:7b'])]",0.7511158943176269,history_mmlu,15092.09758758545,qoa_results_history_mmlu_pop200_gen200_add0p3_flip0p1_mut0p3_level4_bound5_cb1p22em05_lb200_20.csv,"[{""node"": 0, ""type"": ""leaf"", ""model"": ""mistral:7b"", ""prompt"": ""Question: The Mayan king Yax Pahsaj symbolized his royalty on a stele that depicts: A) a series of decisive military conquests against a rival king. B) a depiction of him as a corn god, a symbol of fertility and prosperity. C) a scene of him hunting and defeating a large jaguar. D) an eagle, a serpent, and a jaguar, all of which were important royal animals. E) him receiving a crown from the Mayan god of death and rebirth. F) his coronation ceremony with all the Mayan gods as witnesses. G) a lightning bolt descending from heaven and marking him as the leader. H) a large sun, symbolizing his role as a son of the Sun God. I) the founder of the dynasty \u201cpassing him the torch.\u201d J) him standing on the peak of a mountain to signify his power. Above are multiple-choice questions (with answers) related to history. Respond with the option letter only. Example: F. Do not include any other text or explanation.\n\nSelect the correct answer.\n\nFormat: \""the answer is X)Option text.\""\nExample: \""the answer is C)Hypertension.\""\n\nOutput (nothing else):"", ""raw_output"": ""The answers are as follows:\n\nA) the answer is A) a series of decisive military conquests against a rival king.\nB) the answer is B) a depiction of him as a corn god, a symbol of fertility and prosperity.\nC) the answer is J) him standing on the peak of a mountain to signify his power.\nD) the answer is D) an eagle, a serpent, and a jaguar, all of which were important royal animals.\nE) the answer is E) him receiving a crown from the Mayan god of death and rebirth.\nF) the answer is F. Do not have enough information to provide an accurate response for this question as it requires knowledge about a specific stele or artifact that isn't provided.\nG) the answer is G) a large sun, symbolizing his role as a son of the Sun God.\nH) the answer is I) the founder of the dynasty \u201cpassing him the torch.\u201d (although this question seems to be describing a different event than the one you provided in option H)\n\nAgain, I can only provide answers for questions that have specific artifacts or events mentioned, so my responses may not always cover all questions."", ""output"": ""the answer is A) a series of decisive military conquests against a rival king."", ""input_tokens"": 251, ""output_tokens"": 17}]",0,0.0
B,B,The ________ phase of the PR process consists of making decisions about which strategies and tactics will be used to respond to the goals of the organization and executing those strategies and tactics. A) completion B) implementation C) initiation D) strategizing E) planning F) execution G) development H) monitoring I) evaluation J) tactical Above are multiple-choice questions (with answers) related to other. Respond with the option letter only. Example: F. Do not include any other text or explanation.,1.0,other_mmlu,7.81e-06,14.98384,21.3,"(1,)",results_other_mmlu,9.097e-06,17.453008,1,24.81,"[([0], ['llama3-chatqa:8b'])]",0.739410126209259,other_mmlu,6959.505929708481,qoa_results_other_mmlu_pop200_gen200_add0p3_flip0p1_mut0p3_level4_bound5_cb1p22em05_lb200_20.csv,"[{""node"": 0, ""type"": ""leaf"", ""model"": ""llama3-chatqa:8b"", ""prompt"": ""Question: The ________ phase of the PR process consists of making decisions about which strategies and tactics will be used to respond to the goals of the organization and executing those strategies and tactics. A) completion B) implementation C) initiation D) strategizing E) planning F) execution G) development H) monitoring I) evaluation J) tactical Above are multiple-choice questions (with answers) related to other. Respond with the option letter only. Example: F. Do not include any other text or explanation.\n\nSelect the correct answer.\n\nFormat: \""the answer is X)Option text.\""\nExample: \""the answer is C)Hypertension.\""\n\nOutput (nothing else):"", ""raw_output"": ""# The solution is B) Implementation"", ""output"": ""the answer is B) Implementation."", ""input_tokens"": 135, ""output_tokens"": 7}]",0,1.0
D,H,"The emissivity of tungsten is approximately 0.35. A tungsten sphere 1 cm in radius is suspended within a large evacuated enclosure whose walls are at a temperature of 300 °K. What power input is required to maintain the sphere at a temperature of 3000 °K, if heat conduction along the supports is neglected? A) 2400 watts B) 1000 watts C) 1700 watts D) 2020 watts E) 3200 watts F) 1500 watts G) 1800 watts H) 2250 watts I) 2500 watts J) 2750 watts Above are multiple-choice questions (with answers) related to physics. Respond with the option letter only. Example: F. Do not include any other text or explanation.",0.1293780356645584,physics_mmlu,6.112e-06,21.723251,33.436446999999994,"(0,)",results_physics_mmlu,9.654e-06,27.77769775,1,42.75545674999999,"[([0], ['mistral:7b'])]",0.6672193147242069,physics_mmlu,5619.190279006958,qoa_results_physics_mmlu_pop200_gen200_add0p3_flip0p1_mut0p3_level4_bound5_cb1p22em05_lb200_20.csv,"[{""node"": 0, ""type"": ""leaf"", ""model"": ""mistral:7b"", ""prompt"": ""Question: The emissivity of tungsten is approximately 0.35. A tungsten sphere 1 cm in radius is suspended within a large evacuated enclosure whose walls are at a temperature of 300 \u00b0K. What power input is required to maintain the sphere at a temperature of 3000 \u00b0K, if heat conduction along the supports is neglected? A) 2400 watts B) 1000 watts C) 1700 watts D) 2020 watts E) 3200 watts F) 1500 watts G) 1800 watts H) 2250 watts I) 2500 watts J) 2750 watts Above are multiple-choice questions (with answers) related to physics. Respond with the option letter only. Example: F. Do not include any other text or explanation.\n\nSelect the correct answer.\n\nFormat: \""the answer is X)Option text.\""\nExample: \""the answer is C)Hypertension.\""\n\nOutput (nothing else):"", ""raw_output"": ""the answer is H) 2250 watts."", ""output"": ""the answer is H) 2250 watts."", ""input_tokens"": 199, ""output_tokens"": 10}]",0,0.0
E,J,"The equation of a digital filter is given by $y(n)=1 / 3(x(n)+x(n-1)+x(n-2))$, where $y(n)$ and $x(n)$ are, respectively, the nth samples of the output and input signals. Determine the pole(s) of the filter. A) 1/2 B) 3 C) -3 D) -2 E) 0 F) -1 G) -1/2 H) 1 I) 1/3 J) 2 Above are multiple-choice questions (with answers) related to computer science. Respond with the option letter only. Example: F. Do not include any other text or explanation.",0.3284575045108795,computer science_mmlu,5.526e-06,19.644471000000003,30.236787,"(0,)",results_computer_science_mmlu,8.5826e-06,28.2402263,1,43.4673811,"[([0], ['mistral:7b'])]",0.8209844350814819,computer science_mmlu,9546.104326486588,qoa_results_computer_science_mmlu_pop200_gen200_add0p3_flip0p1_mut0p3_level4_bound5_cb1p22em05_lb200_20.csv,"[{""node"": 0, ""type"": ""leaf"", ""model"": ""mistral:7b"", ""prompt"": ""Question: The equation of a digital filter is given by $y(n)=1 / 3(x(n)+x(n-1)+x(n-2))$, where $y(n)$ and $x(n)$ are, respectively, the nth samples of the output and input signals. Determine the pole(s) of the filter. A) 1/2 B) 3 C) -3 D) -2 E) 0 F) -1 G) -1/2 H) 1 I) 1/3 J) 2 Above are multiple-choice questions (with answers) related to computer science. Respond with the option letter only. Example: F. Do not include any other text or explanation.\n\nSelect the correct answer.\n\nFormat: \""the answer is X)Option text.\""\nExample: \""the answer is C)Hypertension.\""\n\nOutput (nothing else):"", ""raw_output"": ""the answer is J) 1/3"", ""output"": ""the answer is J) 1/3"", ""input_tokens"": 180, ""output_tokens"": 9}]",0,0.0
I,E,The first stage of the demographic transition exhibits A) low birth rates with declining death rates. B) low birth rates with continuing high death rates. C) high birth rates with steady death rates. D) steadily declining birth rates with high death rates. E) high birth rates with declining death rates. F) fluctuating birth rates with fluctuating death rates. G) declining birth rates with continuing high death rates. H) fluctuating birth rates with high death rates. I) high birth rates with high but fluctuating death rates. J) low birth rates with low but fluctuating death rates. Above are multiple-choice questions (with answers) related to other. Respond with the option letter only. Example: F. Do not include any other text or explanation.,0.0044161565601825,other_mmlu,5.994e-06,20.995678,32.316565999999995,"(0,)",results_other_mmlu,8.2142e-06,23.5525774,1,36.2521478,"[([0], ['mistral:7b'])]",0.7015748888254165,other_mmlu,6959.505929708481,qoa_results_other_mmlu_pop200_gen200_add0p3_flip0p1_mut0p3_level4_bound5_cb1p22em05_lb200_20.csv,"[{""node"": 0, ""type"": ""leaf"", ""model"": ""mistral:7b"", ""prompt"": ""Question: The first stage of the demographic transition exhibits A) low birth rates with declining death rates. B) low birth rates with continuing high death rates. C) high birth rates with steady death rates. D) steadily declining birth rates with high death rates. E) high birth rates with declining death rates. F) fluctuating birth rates with fluctuating death rates. G) declining birth rates with continuing high death rates. H) fluctuating birth rates with high death rates. I) high birth rates with high but fluctuating death rates. J) low birth rates with low but fluctuating death rates. Above are multiple-choice questions (with answers) related to other. Respond with the option letter only. Example: F. Do not include any other text or explanation.\n\nSelect the correct answer.\n\nFormat: \""the answer is X)Option text.\""\nExample: \""the answer is C)Hypertension.\""\n\nOutput (nothing else):"", ""raw_output"": ""E) high birth rates with declining death rates"", ""output"": ""the answer is E) high birth rates with declining death rates."", ""input_tokens"": 189, ""output_tokens"": 13}]",0,0.0
G,G,"The notion that there are three major life tasks – friendship, occupation, and love – is MOST consistent with the philosophy of: A) Perls. B) Maslow. C) Erikson. D) Piaget. E) Rogers. F) Berne. G) Adler. H) Bandura. I) Freud. J) Jung. Above are multiple-choice questions (with answers) related to psychology. Respond with the option letter only. Example: F. Do not include any other text or explanation.",1.0,psychology_mmlu,1.032e-05,9.906824,14.186096,"(3,)",results_psychology_mmlu,1.1934e-05,11.0648514,1,15.8443356,"[([0], ['qwen2.5:14b'])]",0.9034036934375764,psychology_mmlu,8909.346123933792,qoa_results_psychology_mmlu_pop200_gen200_add0p3_flip0p1_mut0p3_level4_bound5_cb1p22em05_lb200_20.csv,"[{""node"": 0, ""type"": ""leaf"", ""model"": ""qwen2.5:14b"", ""prompt"": ""Question: The notion that there are three major life tasks \u2013 friendship, occupation, and love \u2013 is MOST consistent with the philosophy of: A) Perls. B) Maslow. C) Erikson. D) Piaget. E) Rogers. F) Berne. G) Adler. H) Bandura. I) Freud. J) Jung. Above are multiple-choice questions (with answers) related to psychology. Respond with the option letter only. Example: F. Do not include any other text or explanation.\n\nSelect the correct answer.\n\nFormat: \""the answer is X)Option text.\""\nExample: \""the answer is C)Hypertension.\""\n\nOutput (nothing else):"", ""raw_output"": ""the answer is G)Adler."", ""output"": ""the answer is G)Adler."", ""input_tokens"": 140, ""output_tokens"": 8}]",0,1.0
C,C,"The price of a product p is $50. The cost per unit is C(x) = 1000 + 0.01x^2, where x is the number of units produced and C(x) is in dollars, (a) What is the profit function? (b) At what value of x is profit maximized? A) P(x) = -0.01x^2 + 30x - 1000, x = 1500 B) P(x) = -0.01x^2 + 100x - 2000, x = 5000 C) P(x)= - 0.01x^2 + 50x - 1000, x = 2500 D) P(x)= - 0.02x^2 + 50x - 1000, x = 1500 E) P(x)= 0.01x^2 + 50x - 1000, x = 2000 F) P(x) = -0.015x^2 + 75x - 1500, x = 3500 G) P(x) = -0.03x^2 + 50x - 3000, x = 1000 H) P(x) = -0.005x^2 + 50x - 500, x = 1000 I) P(x)= - 0.01x^2 + 50x + 1000, x = 3000 J) P(x) = -0.02x^2 + 50x - 2000, x = 1250 Above are multiple-choice questions (with answers) related to business. Respond with the option letter only. Example: F. Do not include any other text or explanation.",1.0,business_mmlu,2.724e-05,27.980084,40.06613600000001,"(3,)",results_business_mmlu,1.0128e-05,9.6926224,1,13.8793696,"[([0], ['qwen2.5:14b'])]",0.79641273021698,business_mmlu,5612.857029676437,qoa_results_business_mmlu_pop200_gen200_add0p3_flip0p1_mut0p3_level4_bound5_cb1p22em05_lb19.47_20.csv,"[{""node"": 0, ""type"": ""leaf"", ""model"": ""qwen2.5:14b"", ""prompt"": ""Question: The price of a product p is $50. The cost per unit is C(x) = 1000 + 0.01x^2, where x is the number of units produced and C(x) is in dollars, (a) What is the profit function? (b) At what value of x is profit maximized? A) P(x) = -0.01x^2 + 30x - 1000, x = 1500 B) P(x) = -0.01x^2 + 100x - 2000, x = 5000 C) P(x)= - 0.01x^2 + 50x - 1000, x = 2500 D) P(x)= - 0.02x^2 + 50x - 1000, x = 1500 E) P(x)= 0.01x^2 + 50x - 1000, x = 2000 F) P(x) = -0.015x^2 + 75x - 1500, x = 3500 G) P(x) = -0.03x^2 + 50x - 3000, x = 1000 H) P(x) = -0.005x^2 + 50x - 500, x = 1000 I) P(x)= - 0.01x^2 + 50x + 1000, x = 3000 J) P(x) = -0.02x^2 + 50x - 2000, x = 1250 Above are multiple-choice questions (with answers) related to business. Respond with the option letter only. Example: F. Do not include any other text or explanation.\n\nSelect the correct answer.\n\nFormat: \""the answer is X)Option text.\""\nExample: \""the answer is C)Hypertension.\""\n\nOutput (nothing else):"", ""raw_output"": ""the answer is C) P(x)= - 0.01x^2 + 50x - 1000, x = 2500"", ""output"": ""the answer is C) P(x)= - 0."", ""input_tokens"": 406, ""output_tokens"": 12}]",0,1.0
