Annotated Answer,Final_Output,Original_Query,Quality_of_Answer,Query Type,Total_Cost,Total_Energy,Total_Latency,assignment,category,cost,energy,iteration,latency,plan,qoa,query_type,run_time_seconds,source_file,step_logs,struct_id,New_QoA_Score
2005,2017,'The Waters Reglitterized' by Laurie Anderson was exhibited during what year?,0.6142691969871521,Art,2.28e-06,2.142016,3.067264,"(3,)",results_art,8.819999999999999e-06,9.0165486,1,12.911264400000002,"[([0], ['qwen2.5:14b'])]",0.4763900198042393,Art,11775.491151809692,qoa_results_art_pop200_gen200_add0p3_flip0p1_mut0p3_level4_bound5_cb1p22em05_lb19.47_20.csv,"[{""node"": 0, ""type"": ""leaf"", ""model"": ""qwen2.5:14b"", ""prompt"": ""Question: 'The Waters Reglitterized' by Laurie Anderson was exhibited during what year?\n\nProvide the accurate answer directly.\n\nOutput (nothing else):"", ""raw_output"": ""2017"", ""output"": ""2017"", ""input_tokens"": 30, ""output_tokens"": 2}]",0,0.6142691373825073
A,B,"00 p.m., traveled 540 miles and arrived at its destination at 2:30 p.m. Find the average speed of the plane in miles per hour. A) 360 mph B) 450 mph C) 330 mph D) 240 mph E) 180 mph F) 420 mph G) 270 mph H) 300 mph I) 600 mph J) 540 mph Above are multiple-choice questions (with answers) related to business. Respond with the option letter only. Example: F. Do not include any other text or explanation.",0.2924385070800781,business_mmlu,1.1339999999999998e-05,10.843956,15.528024,"(3,)",results_business_mmlu,1.0128e-05,9.6926224,1,13.8793696,"[([0], ['qwen2.5:14b'])]",0.79641273021698,business_mmlu,5612.857029676437,qoa_results_business_mmlu_pop200_gen200_add0p3_flip0p1_mut0p3_level4_bound5_cb1p22em05_lb19.47_20.csv,"[{""node"": 0, ""type"": ""leaf"", ""model"": ""qwen2.5:14b"", ""prompt"": ""Question: 00 p.m., traveled 540 miles and arrived at its destination at 2:30 p.m. Find the average speed of the plane in miles per hour. A) 360 mph B) 450 mph C) 330 mph D) 240 mph E) 180 mph F) 420 mph G) 270 mph H) 300 mph I) 600 mph J) 540 mph Above are multiple-choice questions (with answers) related to business. Respond with the option letter only. Example: F. Do not include any other text or explanation.\n\nSelect the correct answer.\n\nFormat: \""the answer is X)Option text.\""\nExample: \""the answer is C)Hypertension.\""\n\nOutput (nothing else):"", ""raw_output"": ""the answer is B) 450 mph."", ""output"": ""the answer is B) 450 mph."", ""input_tokens"": 153, ""output_tokens"": 9}]",0,0.0
E,E,A 100-kg man jumps into a swimming pool from a height of 5 m. It takes 0.4 sec for the water to reduce his veloci-ty to zero. What average force did the water exert on the man? A) - 2000 N B) 1200 N C) 2000 N D) - 2500 N E) - 3480 N F) - 1500 N G) 1000 N H) 500 N I) 980 N J) 3000 N Above are multiple-choice questions (with answers) related to physics. Respond with the option letter only. Example: F. Do not include any other text or explanation.,1.0,physics_mmlu,5.661999999999999e-06,19.956288,30.716736,"(0,)",results_physics_mmlu,9.654e-06,27.77769775,1,42.75545674999999,"[([0], ['mistral:7b'])]",0.6672193147242069,physics_mmlu,5619.190279006958,qoa_results_physics_mmlu_pop200_gen200_add0p3_flip0p1_mut0p3_level4_bound5_cb1p22em05_lb200_20.csv,"[{""node"": 0, ""type"": ""leaf"", ""model"": ""mistral:7b"", ""prompt"": ""Question: A 100-kg man jumps into a swimming pool from a height of 5 m. It takes 0.4 sec for the water to reduce his veloci-ty to zero. What average force did the water exert on the man? A) - 2000 N B) 1200 N C) 2000 N D) - 2500 N E) - 3480 N F) - 1500 N G) 1000 N H) 500 N I) 980 N J) 3000 N Above are multiple-choice questions (with answers) related to physics. Respond with the option letter only. Example: F. Do not include any other text or explanation.\n\nSelect the correct answer.\n\nFormat: \""the answer is X)Option text.\""\nExample: \""the answer is C)Hypertension.\""\n\nOutput (nothing else):"", ""raw_output"": ""E) - 3480 N"", ""output"": ""the answer is E) - 3480 N."", ""input_tokens"": 181, ""output_tokens"": 11}]",0,1.0
B,H,"A 19-year-old Asian female college student comes to the university health center because of a 1-week history of nasal stuffiness, occasional clear rhinorrhea, and a mild sore throat. Two days ago, she began to feel hot, but she has not taken her temperature. Medical history is unremarkable and her only medication is an oral contraceptive. She has no history of allergies. She does not smoke cigarettes. BMI is 22 kg/m2 . Vital signs are temperature 38.1°C (100.6°F), pulse 88/min, respirations 16/min, and blood pressure 116/74 mm Hg. Physical examination discloses tenderness over the left maxillary sinus without purulent drainage. There is clear fluid behind the left tympanic membrane, enlarged tonsils bilaterally, and pain with tapping of the left upper incisors. Left frontal sinus does not transilluminate. Cardiopulmonary examination discloses no abnormalities. Which of the following is the most likely underlying mechanism of this patient's sinusitis? A) Allergic reaction B) Mucosal edema C) Bacterial infection D) Eustachian tube dysfunction E) Immune system disorder F) Fungal infection G) Chronic sinusitis H) Viral infection I) Nasal polyps J) Oral contraceptive use Above are multiple-choice questions (with answers) related to health. Respond with the option letter only. Example: F. Do not include any other text or explanation.",0.3360015451908111,health_mmlu,9.952e-06,36.170772,55.67408399999999,"(0,)",results_health_mmlu,7.2276e-06,25.1116624,1,38.6518928,"[([0], ['mistral:7b'])]",0.6433739781379699,health_mmlu,7951.484551906586,qoa_results_health_mmlu_pop200_gen200_add0p3_flip0p1_mut0p3_level4_bound5_cb1p22em05_lb200_20.csv,"[{""node"": 0, ""type"": ""leaf"", ""model"": ""mistral:7b"", ""prompt"": ""Question: A 19-year-old Asian female college student comes to the university health center because of a 1-week history of nasal stuffiness, occasional clear rhinorrhea, and a mild sore throat. Two days ago, she began to feel hot, but she has not taken her temperature. Medical history is unremarkable and her only medication is an oral contraceptive. She has no history of allergies. She does not smoke cigarettes. BMI is 22 kg/m2 . Vital signs are temperature 38.1\u00b0C (100.6\u00b0F), pulse 88/min, respirations 16/min, and blood pressure 116/74 mm Hg. Physical examination discloses tenderness over the left maxillary sinus without purulent drainage. There is clear fluid behind the left tympanic membrane, enlarged tonsils bilaterally, and pain with tapping of the left upper incisors. Left frontal sinus does not transilluminate. Cardiopulmonary examination discloses no abnormalities. Which of the following is the most likely underlying mechanism of this patient's sinusitis? A) Allergic reaction B) Mucosal edema C) Bacterial infection D) Eustachian tube dysfunction E) Immune system disorder F) Fungal infection G) Chronic sinusitis H) Viral infection I) Nasal polyps J) Oral contraceptive use Above are multiple-choice questions (with answers) related to health. Respond with the option letter only. Example: F. Do not include any other text or explanation.\n\nSelect the correct answer.\n\nFormat: \""the answer is X)Option text.\""\nExample: \""the answer is C)Hypertension.\""\n\nOutput (nothing else):"", ""raw_output"": ""the answer is H) Viral infection"", ""output"": ""the answer is H) Viral infection"", ""input_tokens"": 340, ""output_tokens"": 8}]",0,0.0
G,A,"A 3-way, set-associative cache is A) only effective when more than 3 processes are running alternately on the processor B) possible only with write-through C) one in which each main memory word can be stored at any of 4 cache locations D) possible only with write-back E) effective only if 3 or fewer processes are running alternately on the processor F) one in which each cache can store 3 main memory words G) one in which each main memory word can be stored at any of 3 cache locations Above are multiple-choice questions (with answers) related to computer science. Respond with the option letter only. Example: F. Do not include any other text or explanation.",0.1332716643810272,computer science_mmlu,5.661999999999999e-06,19.956288,30.716736,"(0,)",results_computer_science_mmlu,8.5826e-06,28.2402263,1,43.4673811,"[([0], ['mistral:7b'])]",0.8209844350814819,computer science_mmlu,9546.104326486588,qoa_results_computer_science_mmlu_pop200_gen200_add0p3_flip0p1_mut0p3_level4_bound5_cb1p22em05_lb200_20.csv,"[{""node"": 0, ""type"": ""leaf"", ""model"": ""mistral:7b"", ""prompt"": ""Question: A 3-way, set-associative cache is A) only effective when more than 3 processes are running alternately on the processor B) possible only with write-through C) one in which each main memory word can be stored at any of 4 cache locations D) possible only with write-back E) effective only if 3 or fewer processes are running alternately on the processor F) one in which each cache can store 3 main memory words G) one in which each main memory word can be stored at any of 3 cache locations Above are multiple-choice questions (with answers) related to computer science. Respond with the option letter only. Example: F. Do not include any other text or explanation.\n\nSelect the correct answer.\n\nFormat: \""the answer is X)Option text.\""\nExample: \""the answer is C)Hypertension.\""\n\nOutput (nothing else):"", ""raw_output"": ""A) E, F, G are incorrect options for a 3-way set-associative cache.\n\nOption E is incorrect because it states that the cache is effective only if 3 or fewer processes are running alternately on the processor, but a 3-way set-associative cache is beneficial regardless of the number of processes.\n\nOption F suggests that each cache can store 3 main memory words, which is not correct for a 3-way set-associative cache; it would be a 3x3 cache with 9 lines and 3 sets per line.\n\nOption G incorrectly states that each main memory word can be stored at any of 3 cache locations, but in a 3-way set-associative cache, each set contains 3 cache ways.\n\nTherefore, the correct options for a 3-way set-associative cache are:\n\nA) A 3-way, set-associative cache is possible only with write-back (write policy caching).\n\nB) Incorrect, as it relates to write-through caching.\n\nC) The answer is F) one in which each cache can store 3 main memory words, but it's incorrect because we provided the explanation for this option.\n\nSo, the correct response would be: \""the answer is A) Only possible with write-back.\"""", ""output"": ""the answer is A) Only possible with write-back."", ""input_tokens"": 181, ""output_tokens"": 11}]",0,0.0
I,J,"A 3-week-old male infant is brought to the office by his mother because of a 2-day history of white lesions in the mouth. The infant was born at term via uncomplicated spontaneous vaginal delivery; he has been breast-feeding well and is urinating and having bowel movements normally. At birth, he weighed 3289 g (7 lb 4 oz; 30th percentile). Today, he weighs 3629 kg (8 lb; 25th percentile). He appears adequately hydrated. Vital signs are normal. Physical examination discloses white patches on the tongue and buccal mucosa that do not come off when gently scraped with a tongue blade. Which of the following is the most appropriate pharmacotherapy? A) Fluconazole B) Valacyclovir C) Ketoconazole D) Acyclovir E) Miconazole F) Amphotericin B G) Terbinafine H) Clotrimazole I) Nystatin J) Voriconazole Above are multiple-choice questions (with answers) related to health. Respond with the option letter only. Example: F. Do not include any other text or explanation.",0.1881262362003326,health_mmlu,8.02e-06,28.998981,44.635257,"(0,)",results_health_mmlu,7.2276e-06,25.1116624,1,38.6518928,"[([0], ['mistral:7b'])]",0.6433739781379699,health_mmlu,7951.484551906586,qoa_results_health_mmlu_pop200_gen200_add0p3_flip0p1_mut0p3_level4_bound5_cb1p22em05_lb200_20.csv,"[{""node"": 0, ""type"": ""leaf"", ""model"": ""mistral:7b"", ""prompt"": ""Question: A 3-week-old male infant is brought to the office by his mother because of a 2-day history of white lesions in the mouth. The infant was born at term via uncomplicated spontaneous vaginal delivery; he has been breast-feeding well and is urinating and having bowel movements normally. At birth, he weighed 3289 g (7 lb 4 oz; 30th percentile). Today, he weighs 3629 kg (8 lb; 25th percentile). He appears adequately hydrated. Vital signs are normal. Physical examination discloses white patches on the tongue and buccal mucosa that do not come off when gently scraped with a tongue blade. Which of the following is the most appropriate pharmacotherapy? A) Fluconazole B) Valacyclovir C) Ketoconazole D) Acyclovir E) Miconazole F) Amphotericin B G) Terbinafine H) Clotrimazole I) Nystatin J) Voriconazole Above are multiple-choice questions (with answers) related to health. Respond with the option letter only. Example: F. Do not include any other text or explanation.\n\nSelect the correct answer.\n\nFormat: \""the answer is X)Option text.\""\nExample: \""the answer is C)Hypertension.\""\n\nOutput (nothing else):"", ""raw_output"": ""the answer is J) Nystatin"", ""output"": ""the answer is J) Nystatin"", ""input_tokens"": 271, ""output_tokens"": 8}]",0,0.0
C,J,"A 40-year-old woman comes to the physician because of a 6-month history of increased facial hair growth. Her last menstrual period was 4 months ago. She is 165 cm (5 ft 5 in) tall and weighs 70 kg (154 lb); BMI is 26 kg/m2 . Her pulse is 80/min, and blood pressure is 130/82 mm Hg. Physical examination shows temporal balding and coarse dark hair on the upper lip and chin. Pelvic examination shows clitoral enlargement. Her serum testosterone concentration is increased. Serum concentrations of androstenedione, dehydroepiandrosterone, and urinary 17-ketosteroids are within the reference ranges. Ultrasonography of the pelvis shows a 12-cm ovarian mass. Which of the following best describes this mass? A) Endometrioid tumor B) Fibroma C) Sertoli-Leydig tumor D) Mucinous cystadenoma E) Clear cell carcinoma F) Brenner tumor G) Ovarian carcinoid H) Teratoma I) Serous cystadenoma J) Granulosa tumor Above are multiple-choice questions (with answers) related to health. Respond with the option letter only. Example: F. Do not include any other text or explanation.",0.332362949848175,health_mmlu,8.996e-06,32.428968,49.91469599999999,"(0,)",results_health_mmlu,7.2276e-06,25.1116624,1,38.6518928,"[([0], ['mistral:7b'])]",0.6433739781379699,health_mmlu,7951.484551906586,qoa_results_health_mmlu_pop200_gen200_add0p3_flip0p1_mut0p3_level4_bound5_cb1p22em05_lb200_20.csv,"[{""node"": 0, ""type"": ""leaf"", ""model"": ""mistral:7b"", ""prompt"": ""Question: A 40-year-old woman comes to the physician because of a 6-month history of increased facial hair growth. Her last menstrual period was 4 months ago. She is 165 cm (5 ft 5 in) tall and weighs 70 kg (154 lb); BMI is 26 kg/m2 . Her pulse is 80/min, and blood pressure is 130/82 mm Hg. Physical examination shows temporal balding and coarse dark hair on the upper lip and chin. Pelvic examination shows clitoral enlargement. Her serum testosterone concentration is increased. Serum concentrations of androstenedione, dehydroepiandrosterone, and urinary 17-ketosteroids are within the reference ranges. Ultrasonography of the pelvis shows a 12-cm ovarian mass. Which of the following best describes this mass? A) Endometrioid tumor B) Fibroma C) Sertoli-Leydig tumor D) Mucinous cystadenoma E) Clear cell carcinoma F) Brenner tumor G) Ovarian carcinoid H) Teratoma I) Serous cystadenoma J) Granulosa tumor Above are multiple-choice questions (with answers) related to health. Respond with the option letter only. Example: F. Do not include any other text or explanation.\n\nSelect the correct answer.\n\nFormat: \""the answer is X)Option text.\""\nExample: \""the answer is C)Hypertension.\""\n\nOutput (nothing else):"", ""raw_output"": ""The answer is J) Granulosa tumor."", ""output"": ""the answer is J) Granulosa tumor."", ""input_tokens"": 302, ""output_tokens"": 10}]",0,0.0
B,G,"A 52-year-old man is admitted to the hospital because of severe dyspnea and cough productive of tenacious, brownishyellow sputum for the past 3 weeks. He has a 15-year career history of sandblasting old buildings. He has smoked two packs of cigarettes daily for the past 30 years. The patient is 168 cm (5 ft 6 in) tall and weighs 59 kg (130 lb); BMI is 21 kg/m2 . Vital signs are temperature 36.8°C (98.2°F), pulse 94/min, and blood pressure 150/92 mm Hg. Pulse oximetry on room air shows an oxygen saturation of 70%. On physical examination he is in moderately severe distress with pursed lips and cyanotic nail beds. Chest has an increased anteroposterior diameter. Auscultation of the chest discloses scattered wheezes and rhonchi over all lung fields. Cardiac examination discloses muffled heart sounds and an S4. Fingers are clubbed. Chest x-ray shows hyperinflated lungs, flattened diaphragm, large, irregular opacities in the upper lobes, and eggshell calcifications of the hilar lymph nodes. In addition to antibiotic therapy, which of the following is the most appropriate intervention? A) Lung transplantation B) Continuous humidified oxygen C) Daily chest physiotherapy D) Pulmonary rehabilitation E) Azathioprine therapy F) Bronchoscopy G) Corticosteroid therapy H) Nocturnal continuous positive airway pressure (CPAP) Above are multiple-choice questions (with answers) related to health. Respond with the option letter only. Example: F. Do not include any other text or explanation.",0.1107773184776306,health_mmlu,1.1544e-05,41.887417,64.47314899999999,"(0,)",results_health_mmlu,7.2276e-06,25.1116624,1,38.6518928,"[([0], ['mistral:7b'])]",0.6433739781379699,health_mmlu,7951.484551906586,qoa_results_health_mmlu_pop200_gen200_add0p3_flip0p1_mut0p3_level4_bound5_cb1p22em05_lb200_20.csv,"[{""node"": 0, ""type"": ""leaf"", ""model"": ""mistral:7b"", ""prompt"": ""Question: A 52-year-old man is admitted to the hospital because of severe dyspnea and cough productive of tenacious, brownishyellow sputum for the past 3 weeks. He has a 15-year career history of sandblasting old buildings. He has smoked two packs of cigarettes daily for the past 30 years. The patient is 168 cm (5 ft 6 in) tall and weighs 59 kg (130 lb); BMI is 21 kg/m2 . Vital signs are temperature 36.8\u00b0C (98.2\u00b0F), pulse 94/min, and blood pressure 150/92 mm Hg. Pulse oximetry on room air shows an oxygen saturation of 70%. On physical examination he is in moderately severe distress with pursed lips and cyanotic nail beds. Chest has an increased anteroposterior diameter. Auscultation of the chest discloses scattered wheezes and rhonchi over all lung fields. Cardiac examination discloses muffled heart sounds and an S4. Fingers are clubbed. Chest x-ray shows hyperinflated lungs, flattened diaphragm, large, irregular opacities in the upper lobes, and eggshell calcifications of the hilar lymph nodes. In addition to antibiotic therapy, which of the following is the most appropriate intervention? A) Lung transplantation B) Continuous humidified oxygen C) Daily chest physiotherapy D) Pulmonary rehabilitation E) Azathioprine therapy F) Bronchoscopy G) Corticosteroid therapy H) Nocturnal continuous positive airway pressure (CPAP) Above are multiple-choice questions (with answers) related to health. Respond with the option letter only. Example: F. Do not include any other text or explanation.\n\nSelect the correct answer.\n\nFormat: \""the answer is X)Option text.\""\nExample: \""the answer is C)Hypertension.\""\n\nOutput (nothing else):"", ""raw_output"": ""the answer is G) Corticosteroid therapy"", ""output"": ""the answer is G) Corticosteroid therapy"", ""input_tokens"": 393, ""output_tokens"": 10}]",0,0.0
A,A,A Michelson interferometer is used for measuring the separation of a doublet of atomic emission lines. The average wavelength of the doublet is known to be 676 nm. Periodic variations of the fringe contrast are found whenever one of the mirrors is moved through a distance of 0.44 mm. What are the two wavelengths of the doublet? A) 675.74 nm and 676.26 nm B) 676.1 nm and 675.9 nm C) 672 nm and 680 nm D) 675 nm and 677 nm E) 674 nm and 678 nm F) 670 nm and 680 nm G) 674.5 nm and 677.5 nm H) 673 nm and 679 nm I) 676.5 nm and 675.5 nm J) 677 nm and 675 nm Above are multiple-choice questions (with answers) related to physics. Respond with the option letter only. Example: F. Do not include any other text or explanation.,1.0,physics_mmlu,7.32e-06,26.400506,40.635682,"(0,)",results_physics_mmlu,9.654e-06,27.77769775,1,42.75545674999999,"[([0], ['mistral:7b'])]",0.6672193147242069,physics_mmlu,5619.190279006958,qoa_results_physics_mmlu_pop200_gen200_add0p3_flip0p1_mut0p3_level4_bound5_cb1p22em05_lb200_20.csv,"[{""node"": 0, ""type"": ""leaf"", ""model"": ""mistral:7b"", ""prompt"": ""Question: A Michelson interferometer is used for measuring the separation of a doublet of atomic emission lines. The average wavelength of the doublet is known to be 676 nm. Periodic variations of the fringe contrast are found whenever one of the mirrors is moved through a distance of 0.44 mm. What are the two wavelengths of the doublet? A) 675.74 nm and 676.26 nm B) 676.1 nm and 675.9 nm C) 672 nm and 680 nm D) 675 nm and 677 nm E) 674 nm and 678 nm F) 670 nm and 680 nm G) 674.5 nm and 677.5 nm H) 673 nm and 679 nm I) 676.5 nm and 675.5 nm J) 677 nm and 675 nm Above are multiple-choice questions (with answers) related to physics. Respond with the option letter only. Example: F. Do not include any other text or explanation.\n\nSelect the correct answer.\n\nFormat: \""the answer is X)Option text.\""\nExample: \""the answer is C)Hypertension.\""\n\nOutput (nothing else):"", ""raw_output"": ""\""the answer is A) 675.74 nm and 676.26 nm\"""", ""output"": ""the answer is A) 675."", ""input_tokens"": 246, ""output_tokens"": 8}]",0,1.0
A,H,A chemical agent is found to denature all enzymes in the synaptic cleft. What effect will this agent have on acetylcholine? A) Acetylcholine will not be degraded in the synaptic cleft. B) Acetylcholine will not bind to receptor proteins on the postsynaptic membrane. C) Acetylcholine will not be produced in the presynaptic membrane. D) Acetylcholine will be excessively produced in the synaptic cleft. E) Acetylcholine will not be transported to the synaptic cleft. F) Acetylcholine will bind excessively to receptor proteins on the postsynaptic membrane. G) Acetylcholine will be degraded at a faster rate in the synaptic cleft. H) Acetylcholine will not be released from the presynaptic membrane. I) Acetylcholine will be released in large quantities from the presynaptic membrane. J) Acetylcholine will not diffuse across the cleft to the postsynaptic membrane. Above are multiple-choice questions (with answers) related to biology. Respond with the option letter only. Example: F. Do not include any other text or explanation.,1.0,biology_mmlu,8.779999999999999e-06,30.662005,47.194985,"(0,)",results_biology_mmlu,8.335799999999999e-06,27.9803788,1,43.0674236,"[([0], ['mistral:7b'])]",0.8395025610923768,biology_mmlu,5469.501084327698,qoa_results_biology_mmlu_pop200_gen200_add0p3_flip0p1_mut0p3_level4_bound5_cb1p22em05_lb200_20.csv,"[{""node"": 0, ""type"": ""leaf"", ""model"": ""mistral:7b"", ""prompt"": ""Question: A chemical agent is found to denature all enzymes in the synaptic cleft. What effect will this agent have on acetylcholine? A) Acetylcholine will not be degraded in the synaptic cleft. B) Acetylcholine will not bind to receptor proteins on the postsynaptic membrane. C) Acetylcholine will not be produced in the presynaptic membrane. D) Acetylcholine will be excessively produced in the synaptic cleft. E) Acetylcholine will not be transported to the synaptic cleft. F) Acetylcholine will bind excessively to receptor proteins on the postsynaptic membrane. G) Acetylcholine will be degraded at a faster rate in the synaptic cleft. H) Acetylcholine will not be released from the presynaptic membrane. I) Acetylcholine will be released in large quantities from the presynaptic membrane. J) Acetylcholine will not diffuse across the cleft to the postsynaptic membrane. Above are multiple-choice questions (with answers) related to biology. Respond with the option letter only. Example: F. Do not include any other text or explanation.\n\nSelect the correct answer.\n\nFormat: \""the answer is X)Option text.\""\nExample: \""the answer is C)Hypertension.\""\n\nOutput (nothing else):"", ""raw_output"": ""the answer is H) Acetylcholine will not be released from the presynaptic membrane."", ""output"": ""the answer is H) Acetylcholine will not be released from the presynaptic membrane."", ""input_tokens"": 275, ""output_tokens"": 20}]",0,0.0
